[
  {
    "id": "source-pmo-almanac-qa",
    "title": "历书科普问题解答",
    "authors": [
      "中国科学院紫金山天文台"
    ],
    "publisher": "紫金山天文台官网科普动态",
    "published": "2022-03-17",
    "url": "http://www.pmo.cas.cn/xwdt2019/kpdt2019/202203/t20220317_6399980.html",
    "citation": "中国科学院紫金山天文台：《历书科普问题解答》，2022-03-17。",
    "source_type": "institutional",
    "access": "direct-read",
    "accessed": "2026-09-16",
    "original_excerpt": "一年的二十四节气，反映了地球在绕太阳运行轨道上的不同位置，属于阳历范畴。在阳历中节气日期变化不大，但在农历中节气日期却非常不固定。……农历闰月的安排是人为的规定……取其中最先出现的一个不包含中气（即雨水……）的农历月为闰月。",
    "locator": "\"为什么农历有的月份没有中气\"等问答条目；页面另含农历月大小、年三十有无、双立春/无立春等解答。",
    "ai_summary": "中国历法权威计算机构（紫金山天文台编算《中国天文年历》）的科普问答：节气属阳历成分、农历为阴阳合历；朔日定初一；冬至定十一月；两冬至间含13个朔望月则置闰、取首个无中气之月；节气日期公历稳定、农历漂移的原因；立春2月4日左右与春节1月21日-2月20日变动可产生双立春/无立春年。",
    "rights": "机构官网公开内容；仅引用要点与短摘录。",
    "verification": "human-verified"
  },
  {
    "id": "source-hko-solar-terms",
    "title": "The 24 Solar Terms",
    "authors": [
      "Hong Kong Observatory"
    ],
    "publisher": "Hong Kong Observatory",
    "published": "2020-05-18 (page revision)",
    "url": "https://www.hko.gov.hk/en/gts/time/24solarterms.htm",
    "citation": "Hong Kong Observatory. The 24 Solar Terms. Calendar; revision 18 May 2020.",
    "source_type": "institutional",
    "access": "direct-read",
    "accessed": "2026-09-16",
    "original_excerpt": "The 24 solar terms divide the ecliptic into 24 equal segments, with 15 degrees of the Sun's longitude between the terms.",
    "locator": "Paragraph beginning From the Earth's perspective; next paragraph discusses regional climate and agriculture.",
    "ai_summary": "页面介绍黄经15度分段、节气名称与天气农业经验，并限定为古代中国中部气候的部分反映。",
    "rights": "Source retains rights; metadata and limited excerpt only; no image reuse.",
    "verification": "human-verified"
  },
  {
    "id": "source-ihchina-chushu-feature",
    "title": "最好新秋时——二十四节气之处暑（节气专题）",
    "authors": [
      "中国非物质文化遗产网·中国非物质文化遗产数字博物馆（编者整理）"
    ],
    "publisher": "中国艺术研究院（中国非物质文化遗产保护中心）",
    "published": "2017-08-23",
    "url": "https://www.ihchina.cn/solar_details/6974.html",
    "citation": "中国非物质文化遗产网：《最好新秋时——二十四节气之处暑》，节气专题页，2026-09-16 读取。",
    "source_type": "institutional",
    "access": "direct-read",
    "accessed": "2026-09-16",
    "original_excerpt": "太阳到达黄经150°时，为二十四节气中的第十四个节气——处暑，今年的处暑时间是2017年8月23日（农历丁酉年七月初二）。《月令七十二候集解》记载：\"处，止也，暑气至此而止矣。\"处暑意味着炎热的夏天即将结束，气温逐渐下降。处暑节气的物候特征是：\"一候鹰乃祭鸟；二候天地始肃；三候禾乃登。\"……处暑节气之后，长江以北地区气温逐渐下降，早晚已有浓重的凉意，白昼时间减少。……每年处暑期间，浙江省沿海都要举行隆重的开渔节，欢送渔民开船出海。著名的开渔节有象山开渔节、舟山开渔节、江川开渔节等。",
    "locator": "\"节气概说\"\"农事农谚\"\"节气习俗\"（祭祖/出游迎秋/吃鸭子/开渔节）\"节气养生\"各节；农谚11条；配图来源标注\"网络\"。",
    "ai_summary": "国家级非遗机构处暑专题：定义（黄经150°、第十四个节气）、2017年处暑落8月23日农历七月初二的实例、三候及白话释义、农事（中稻收获、蓄水、华西秋雨）、农谚群（流传地域未逐一标明）、祭祖（锚定农历七月十五中元节与七月初一起的普渡布施、中元夜放河灯）、出游迎秋（\"七月八月看巧云\"）、吃鸭子（北京处暑百合鸭）、开渔节（\"每年处暑期间\"浙江沿海，象山/舟山/江川）。",
    "rights": "页面无逐条出处标注，属\"机构发布+编辑汇编\"；引用需谨慎，配图一律不用。",
    "verification": "human-verified"
  },
  {
    "id": "source-xinhua-chushu-2022",
    "title": "节令之美·处暑丨23日处暑，即将出伏",
    "authors": [
      "新华社（记者周润健；受访：天津民俗专家、专栏作家由国庆）"
    ],
    "publisher": "新华网",
    "published": "2022-08-21",
    "url": "http://www.news.cn/2022-08/21/c_1128933126.htm",
    "citation": "新华社：《节令之美·处暑丨23日处暑，即将出伏》，2022-08-21。",
    "source_type": "institutional",
    "access": "direct-read",
    "accessed": "2026-09-16",
    "original_excerpt": "公历每年8月22日至24日，当太阳到达黄经150度时，为处暑之始，它是二十四节气中第十四个节气，也是秋季第二个节气。处暑，即为\"出暑\"，是炎热离开的意思。这时，三伏天气已过或是接近尾声。……民谚说\"处暑天还暑，好似秋老虎\"，我国不少地区，尤其是南方地区，\"秋老虎\"依然会持续一段时间。……俗话说\"处暑十八盆，白露勿露身\"……处暑时节的天气一般中午比较炎热，早晚会凉爽起来，再加上时不时来上一两场雨，正是\"一场秋雨一场凉\"。……宋人苏泂也说：\"处暑无三日，新凉直万金。\"……处暑三候\"禾乃登\"，\"禾\"指的是黍、稷、稻、粱类农作物的总称，\"登\"即成熟的意思。",
    "locator": "第3-6段（定义/秋老虎/谚语/文学引文/禾乃登释义）；2022年处暑时刻8月23日11时16分、末伏第九天等实例。",
    "ai_summary": "新华社节令科普稿（民俗专家由国庆受访）：黄经150°/公历8月22-24日/第十四个节气/秋季第二个；\"出暑\"白话释义；处暑与出伏的相对位置（2022年处暑在末伏第九天）；秋老虎（南方持续）、昼夜温差、谚语三条；苏泂、白居易诗句引文；禾乃登释义（黍稷稻粱总称、登=成熟）；养生建议。",
    "rights": "新华社版权稿；仅要点级短引。",
    "verification": "human-verified"
  },
  {
    "id": "source-yueling-qishierhou-wikisource",
    "title": "月令七十二候集解（维基文库全文）",
    "authors": [
      "传统题名：吴澄"
    ],
    "publisher": "Wikisource（维基文库）",
    "published": null,
    "url": "https://zh.wikisource.org/wiki/月令七十二候集解",
    "citation": "《月令七十二候集解》，传统题名（元）吴澄撰，维基文库全文本，2026-09-16 读取。",
    "source_type": "historical",
    "access": "direct-read",
    "accessed": "2026-09-16",
    "original_excerpt": "立春，正月節。立，建始也。五行之氣往者過來者續于此。而春木之氣始至，故謂之立也。立夏、秋、冬同。……東風解凍。凍結于冬，遇春風而解散……蟄蟲始振。蟄，藏也；振，動也。密藏之蟲，因氣至，而皆蘇動之矣……魚陟負冰。陟，升也。魚當盛寒伏水底而遂暖，至正月陽氣至，則上遊而近冰，故曰負。",
    "locator": "全书第一节\"立春\"，维基文库全文页；三候条目依次位于立春节之内。",
    "ai_summary": "该书将立春列为全书首节，给出\"立，建始也\"的定义，并按五日一候列立春三候：东风解冻、蛰虫始振、鱼陟负冰，各附简注。紧随其后为雨水节。",
    "rights": "原文属公有领域古籍；维基文库文本依其站点许可提供。仅记录元数据与短摘录。",
    "verification": "human-verified"
  },
  {
    "id": "source-weathercn-chushu-2026",
    "title": "处暑节气：长城以北秋高气爽 南方需警惕\"秋老虎\"",
    "authors": [
      "中国天气网（策划杜冰冰；数据支持霍云怡、林楠）"
    ],
    "publisher": "中国气象局公共气象服务中心（中国天气网）",
    "published": "2026-08-21",
    "url": "https://www.weather.com.cn/life/2026/08/4770851.shtml",
    "citation": "中国天气网：《处暑节气：长城以北秋高气爽 南方需警惕\"秋老虎\"》，2026-08-21。",
    "source_type": "institutional",
    "access": "direct-read",
    "accessed": "2026-09-16",
    "original_excerpt": "处暑时节，意味着炎热即将过去，秋风渐起送清凉。但我国幅员辽阔，各地由热转凉的时间也不尽相同。常年此时，北方多地昼夜温差加大，长城以北多地陆续进入秋高气爽的时节；南方则暑热未消，长江中下游一带高温余威尚存，小心\"秋老虎\"出没。……新疆、内蒙古西部、陕西关中、山西南部、辽宁、河北部分地区将会开启入秋进程。……南方地区此时高温最盛阶段已过，但由于副热带高压还会不时西伸，长江中下游一带高温天气依然频繁……处暑节气期间，我国华西地区的秋雨也将逐渐开启。此时冷空气频繁南下，与滞留在西部地区的暖湿气流相遇，往往会给甘肃东南部、陕西南部、四川、重庆、贵州、云南等地带来长时间的阴雨天气。……处暑节气处在夏秋之交，台风依然活跃……与夏台风相比，秋台风路径更加复杂多变，预报难度也更大。",
    "locator": "正文四段（北方入秋/南方秋老虎/华西秋雨成因/秋台风）。",
    "ai_summary": "气象机构（中国天气网=中国气象局公共气象服务中心）处暑气候科普：分区气候图景——长城以北入秋、新疆内蒙古西部陕西关中山西南部辽宁河北部分开启入秋进程；华北中南部黄淮南方大部仍在夏季；南方高温最盛已过但副高西伸致长江中下游\"秋老虎\"；华西秋雨=冷空气与暖湿气流相遇的长时间阴雨（陇东南陕南川渝黔滇）；秋台风活跃、路径更复杂。",
    "rights": "中国天气网版权（\"原创未经授权不得转载\"）；仅要点级短引。",
    "verification": "human-verified"
  },
  {
    "id": "source-xinhua-unesco-solarterms",
    "title": "二十四节气入选《人类非物质文化遗产代表名录》",
    "authors": [
      "新华社记者"
    ],
    "publisher": "新华网",
    "published": "2016-11-30",
    "url": "http://www.xinhuanet.com/politics/2016-11/30/c_129385180.htm",
    "citation": "新华社：《\"二十四节气\"入选联合国教科文组织人类非物质文化遗产代表作名录》，2016-11-30。",
    "source_type": "institutional",
    "access": "direct-read",
    "accessed": "2026-09-16",
    "original_excerpt": "项目全称\"二十四节气——中国人通过观察太阳周年运动而形成的时间知识体系及其实践\"；2006年列入第一批国家级非遗名录；2011年九华立春祭、班春劝农、石阡说春列入扩展名录；2014年三门祭冬、壮族霜降节、苗族赶秋、安仁赶分社列入扩展名录；决议于2016年11月30日在亚的斯亚贝巴举行的第十一届政府间委员会常会通过。",
    "locator": "报道正文；届会地点埃塞俄比亚亚的斯亚贝巴，会议期2016-11-28至12-02。",
    "ai_summary": "国家通讯社通稿，给出入选日期、届会、项目全称、国家级非遗与扩展项目时间线，以及\"形成于黄河流域、以天象气温降水物候时序变化为观察基准\"的描述。",
    "rights": "新华社版权所有；仅引用事实要点与短摘录。",
    "verification": "human-verified"
  },
  {
    "id": "source-ihchina-jiuhua-lichunji",
    "title": "农历二十四节气（九华立春祭）项目页",
    "authors": [
      "中国非物质文化遗产网·中国非物质文化遗产数字博物馆"
    ],
    "publisher": "中国艺术研究院（中国非物质文化遗产保护中心）",
    "published": null,
    "url": "https://www.ihchina.cn/project_details/15060.html",
    "citation": "中国非物质文化遗产网：\"农历二十四节气（九华立春祭）\"，2011年第三批国家级非遗扩展项目，编号Ⅹ-68，浙江省衢州市柯城区。",
    "source_type": "institutional",
    "access": "direct-read",
    "accessed": "2026-09-16",
    "original_excerpt": "以农历立春日为祭祀日，九华梧桐祖殿是立春祭主要活动场所。主要活动有：祭拜春神句芒、迎春接福赐求五谷丰登、供祭品、扮芒神、焚香迎奉、扎春牛、演戏酬神、踏青、鞭春牛等。鞭春牛是整个立春祭活动的重要环节，由选定的人装扮成芒神鞭打春牛。",
    "locator": "项目详情页正文\"基本信息\"与\"主要内容\"部分；项目序号516，保护单位衢州市柯城区文化馆。",
    "ai_summary": "国家级非遗权威机构项目页，确认九华立春祭的申报地、批次、类别（民俗）与仪式构成，鞭春牛为核心环节，与劝农春耕相关联。",
    "rights": "网站版权所有；仅引用事实要点与短摘录。",
    "verification": "human-verified"
  }
]