[
  {
    "id": "source-pmo-almanac-qa",
    "title": "历书科普问题解答",
    "authors": [
      "中国科学院紫金山天文台"
    ],
    "publisher": "紫金山天文台官网科普动态",
    "published": "2022-03-17",
    "url": "http://www.pmo.cas.cn/xwdt2019/kpdt2019/202203/t20220317_6399980.html",
    "citation": "中国科学院紫金山天文台：《历书科普问题解答》，2022-03-17。",
    "source_type": "institutional",
    "access": "direct-read",
    "accessed": "2026-09-16",
    "original_excerpt": "一年的二十四节气，反映了地球在绕太阳运行轨道上的不同位置，属于阳历范畴。在阳历中节气日期变化不大，但在农历中节气日期却非常不固定。……农历闰月的安排是人为的规定……取其中最先出现的一个不包含中气（即雨水……）的农历月为闰月。",
    "locator": "\"为什么农历有的月份没有中气\"等问答条目；页面另含农历月大小、年三十有无、双立春/无立春等解答。",
    "ai_summary": "中国历法权威计算机构（紫金山天文台编算《中国天文年历》）的科普问答：节气属阳历成分、农历为阴阳合历；朔日定初一；冬至定十一月；两冬至间含13个朔望月则置闰、取首个无中气之月；节气日期公历稳定、农历漂移的原因；立春2月4日左右与春节1月21日-2月20日变动可产生双立春/无立春年。",
    "rights": "机构官网公开内容；仅引用要点与短摘录。",
    "verification": "human-verified"
  },
  {
    "id": "source-hko-solar-terms",
    "title": "The 24 Solar Terms",
    "authors": [
      "Hong Kong Observatory"
    ],
    "publisher": "Hong Kong Observatory",
    "published": "2020-05-18 (page revision)",
    "url": "https://www.hko.gov.hk/en/gts/time/24solarterms.htm",
    "citation": "Hong Kong Observatory. The 24 Solar Terms. Calendar; revision 18 May 2020.",
    "source_type": "institutional",
    "access": "direct-read",
    "accessed": "2026-09-16",
    "original_excerpt": "The 24 solar terms divide the ecliptic into 24 equal segments, with 15 degrees of the Sun's longitude between the terms.",
    "locator": "Paragraph beginning From the Earth's perspective; next paragraph discusses regional climate and agriculture.",
    "ai_summary": "页面介绍黄经15度分段、节气名称与天气农业经验，并限定为古代中国中部气候的部分反映。",
    "rights": "Source retains rights; metadata and limited excerpt only; no image reuse.",
    "verification": "human-verified"
  },
  {
    "id": "source-ihchina-hanlu-feature",
    "title": "气收天地广——二十四节气之寒露（节气专题）",
    "authors": [
      "中国非物质文化遗产网·中国非物质文化遗产数字博物馆（编者整理）"
    ],
    "publisher": "中国艺术研究院（中国非物质文化遗产保护中心）",
    "published": "2017-10-09",
    "url": "https://www.ihchina.cn/solar_details/6977.html",
    "citation": "中国非物质文化遗产网：《气收天地广——二十四节气之寒露》，节气专题页，2026-09-16 读取。",
    "source_type": "institutional",
    "access": "direct-read",
    "accessed": "2026-09-16",
    "original_excerpt": "寒露是二十四节气的第17个节气，时间在公历10月8日或9日，太阳到达黄经195°时，今年的寒露时间是2017年10月8日（农历丁酉年八月十九日）。《月令七十二候集解》记载：\"九月节，露气寒冷，将凝结也。\"寒露时的气温比白露时更低，地面的露水快要凝结成霜了。古代将寒露分为三候：\"一候鸿雁来宾；二候雀入大水为蛤；三候菊有黄华。\"……\"寒露寒露，遍地冷露。\"此时我国大部分地区已进入秋季……寒露和霜降节气，时值农历九月，人们一直保持着农历九月九日重阳节登高的习俗……农历九月又称菊月，菊花为寒露时节最具代表性的花卉……白露、秋分和寒露，是北京、杭州等地市民斗蟋蟀的高潮期……老南京有喝\"寒露茶\"的习惯。每年寒露的前三天和后四天所采之茶，叫作\"正秋茶\"……俗话说：\"白露身不露，寒露脚不露。\"",
    "locator": "\"节气概说\"\"农事农谚\"\"节气习俗（登高赏菊/斗蟋蟀/秋钓边/饮菊花酒/喝寒露茶）\"\"节气养生\"各节；农谚组含\"秋分早，霜降迟，寒露种麦正当时\"等；淮北油菜蚕豆播种条目。",
    "ai_summary": "国家级非遗机构寒露专题：定义（第17个、公历10月8日或9日、黄经195°、2017年实例10月8日）、月令引文与三候今译、气候（气温比白露更低、露将凝结、东北新疆开始飘雪、海南西南秋雨）、农事（秋收棉花/寒露种麦谚群/淮北油菜蚕豆/高原雪害）、习俗（重阳登高赏菊、北京杭州斗蟋蟀、南方秋钓边、菊花酒、老南京寒露茶/正秋茶）、养生（芝麻糯米蜂蜜、菊黄蟹肥母蟹、\"寒露脚不露\"、春捂秋冻）。",
    "rights": "页面声明\"部分图文内容来自网络，经编者整理\"——引用需谨慎，配图一律不用。",
    "verification": "human-verified"
  },
  {
    "id": "source-xinhua-hanlu-2022",
    "title": "8日15时22分寒露：寒花开已尽，菊蕊独盈枝（新华社）",
    "authors": [
      "新华社记者 周润健"
    ],
    "publisher": "新华网",
    "published": "2022-10-07",
    "url": "http://www.news.cn/politics/2022-10/07/c_1129053970.htm",
    "citation": "新华社：《8日15时22分寒露：寒花开已尽，菊蕊独盈枝》，2022-10-07。",
    "source_type": "institutional",
    "access": "direct-read",
    "accessed": "2026-09-16",
    "original_excerpt": "北京时间10月8日15时22分将迎来寒露节气，意味着深秋到来。此时节，寒露如玉，夜凉似水，我国大部分地区气温下降速度逐渐加快，昼夜温差增大。天津民俗专家、专栏作家由国庆介绍，作为一个反映气候变化特征的节气，公历每年10月7日至9日，当太阳到达黄经195度时为寒露之始，它是二十四节气中第十七个节气，也是秋季第五个节气。如果说白露是由炎热向凉爽的转折，那么寒露则是凉爽向寒冷的过渡。寒露过后，北半球阳光照射的角度开始明显倾斜，地面接收的热量比夏季明显减少，冷空气势力进一步增强。此时白昼渐短，夜晚渐长，日照减少，热气慢慢褪去，寒气渐渐增多，空气较为干燥。与此同时，昼夜温差加大，人们在清晨、夜晚会略感寒意。",
    "locator": "导语与\"由国庆介绍\"两段；后文菊花诗句与饮食调理段（适当多吃甘淡滋润食品，如梨、柿子、山楂、石榴、萝卜、百合、银耳、海带、蜂蜜、芝麻等）。",
    "ai_summary": "新华社2022寒露节气稿（天津电）：当年交节时刻10月8日15时22分；定义（公历每年10月7日至9日、黄经195度、第十七个、秋季第五个）；气候定位（白露=炎热向凉爽转折、寒露=凉爽向寒冷过渡；日照减少、冷空气增强、昼夜温差加大）；菊花意象与咏菊诗句；养生饮食建议。",
    "rights": "新华社版权稿；仅要点级引用与短摘录。",
    "verification": "human-verified"
  },
  {
    "id": "source-yueling-qishierhou-wikisource",
    "title": "月令七十二候集解（维基文库全文）",
    "authors": [
      "传统题名：吴澄"
    ],
    "publisher": "Wikisource（维基文库）",
    "published": null,
    "url": "https://zh.wikisource.org/wiki/月令七十二候集解",
    "citation": "《月令七十二候集解》，传统题名（元）吴澄撰，维基文库全文本，2026-09-16 读取。",
    "source_type": "historical",
    "access": "direct-read",
    "accessed": "2026-09-16",
    "original_excerpt": "立春，正月節。立，建始也。五行之氣往者過來者續于此。而春木之氣始至，故謂之立也。立夏、秋、冬同。……東風解凍。凍結于冬，遇春風而解散……蟄蟲始振。蟄，藏也；振，動也。密藏之蟲，因氣至，而皆蘇動之矣……魚陟負冰。陟，升也。魚當盛寒伏水底而遂暖，至正月陽氣至，則上遊而近冰，故曰負。",
    "locator": "全书第一节\"立春\"，维基文库全文页；三候条目依次位于立春节之内。",
    "ai_summary": "该书将立春列为全书首节，给出\"立，建始也\"的定义，并按五日一候列立春三候：东风解冻、蛰虫始振、鱼陟负冰，各附简注。紧随其后为雨水节。",
    "rights": "原文属公有领域古籍；维基文库文本依其站点许可提供。仅记录元数据与短摘录。",
    "verification": "human-verified"
  },
  {
    "id": "source-xinhua-hanlu-2021",
    "title": "8日9时39分\"寒露\"：风入蒹葭秋色晚，气冷露凝雁南归（新华社）",
    "authors": [
      "新华社记者 周润健"
    ],
    "publisher": "新华网",
    "published": "2021-10-06",
    "url": "http://www.news.cn/science/2021-10/06/c_1127932546.htm",
    "citation": "新华社：《8日9时39分\"寒露\"：风入蒹葭秋色晚，气冷露凝雁南归》，2021-10-06。",
    "source_type": "institutional",
    "access": "direct-read",
    "accessed": "2026-09-16",
    "original_excerpt": "历史学者、天津社科院研究员罗澍伟介绍说，每年公历的10月7日、8日或9日，太阳到达黄经195度，为\"寒露\"节气开始。此时节，北半球阳光照射角度明显倾斜，地面接收的阳光热量显著减少，白天秋高气爽，夜晚冷若冰霜，因此\"寒露\"成为二十四节气中第一个带\"寒\"字的节气。\"寒露寒露，遍地冷露\"。古人根据对大自然的观察，将\"寒露\"分为三候：一候鸿雁来宾；二候雀入大水为蛤；三候菊有黄华。……由于\"寒露\"是气候从凉爽到寒冷的过渡和转折，相对于\"白露\"而言，\"寒露\"期间气候更凉，气温更低，标志着深秋来临。\"露气寒冷，将凝结也\"，甚至可见初霜，所以\"寒露\"之后的节气便是\"霜降\"。",
    "locator": "导语（《2021年中国天文年历》交节时刻）与罗澍伟介绍三段；后文养生段（\"寒露脚不露\"、足部保暖、饮食润燥）。",
    "ai_summary": "新华社2021寒露节气稿（天津电）：定义（每年公历10月7日、8日或9日、黄经195度）；\"二十四节气中第一个带寒字的节气\"表述；\"寒露寒露，遍地冷露\"民谚；三候候名；由凉转寒定位（相对于白露气候更凉气温更低、可见初霜、下一节气为霜降）；养生（脚不露/足部保暖/润燥食物）。",
    "rights": "新华社版权稿；仅要点级引用与短摘录。",
    "verification": "human-verified"
  },
  {
    "id": "source-wikisource-jingchu-suishiji",
    "title": "荊楚歲時記（维基文库全文）",
    "authors": [
      "宗懔（南朝梁）撰",
      "杜公瞻（隋）注"
    ],
    "publisher": "Wikisource（维基文库）",
    "published": null,
    "url": "https://zh.wikisource.org/wiki/荊楚歲時記",
    "citation": "宗懔：《荆楚岁时记》，杜公瞻注，维基文库全文本，2026-09-16 读取。",
    "source_type": "historical",
    "access": "direct-read",
    "accessed": "2026-09-16",
    "original_excerpt": "立春之日，悉翦綵為鷵以戴之，帖「宜春」二字。……（正月一日条）於是長幼悉正衣冠，以次拜賀，進椒柏酒，飲桃湯，進屠蘇酒，膠牙餳，下五辛盤。",
    "locator": "\"立春之日\"条与\"正月一日\"条；五辛盘明确位于正月一日条下，注文引周处《风土记》\"元日造五辛盘\"。",
    "ai_summary": "六世纪荆楚地区岁时记录：立春日的习俗只有剪彩为燕、帖宜春（另有施钩、打球秋千之戏）；五辛盘记于正月一日（元日）条。这一文本位置关系是辨析\"五辛盘/春盘与立春关系\"的关键证据。注：该本\"翦綵為鷵\"用字为稀有异体，通行本多作\"燕\"。",
    "rights": "原文属公有领域古籍；维基文库文本依其站点许可。仅记录元数据与短摘录。",
    "verification": "human-verified"
  },
  {
    "id": "source-wikisource-yanjingsuishiji",
    "title": "燕京歲時記（维基文库全文）",
    "authors": [
      "富察敦崇（清）"
    ],
    "publisher": "Wikisource（维基文库）",
    "published": null,
    "url": "https://zh.wikisource.org/wiki/燕京歲時記",
    "citation": "富察敦崇：《燕京岁时记》，维基文库全文本，2026-09-16 读取。",
    "source_type": "historical",
    "access": "direct-read",
    "accessed": "2026-09-16",
    "original_excerpt": "打春即立春，在正月者居多。立春先一日，順天府官員至東直門外一里春場迎春。立春日，禮部呈進春山寶座，順天府呈進春牛圖。禮畢回署，引春牛而擊之，曰打春。……是日富家多食春餅，婦女等多買羅卜而食之，曰咬春，謂可以卻春困也。",
    "locator": "\"打春\"条（正月部分，目录编号1.7，\"咬春\"内容在该条内非独立条目）；条后\"謹按\"引《禮部則例》述官方迎春礼仪。",
    "ai_summary": "清末北京岁时志：立春前一日顺天府官员赴东直门外春场迎春，立春日礼部进春山宝座、顺天府进春牛图、击春牛曰打春（官方礼仪）；当日富家食春饼、妇女买萝卜食之曰咬春\"谓可以卻春困\"。咬春不独立成条，系于打春条内。",
    "rights": "原文属公有领域古籍；维基文库文本依其站点许可。仅记录元数据与短摘录。",
    "verification": "human-verified"
  },
  {
    "id": "source-xinhua-unesco-solarterms",
    "title": "二十四节气入选《人类非物质文化遗产代表名录》",
    "authors": [
      "新华社记者"
    ],
    "publisher": "新华网",
    "published": "2016-11-30",
    "url": "http://www.xinhuanet.com/politics/2016-11/30/c_129385180.htm",
    "citation": "新华社：《\"二十四节气\"入选联合国教科文组织人类非物质文化遗产代表作名录》，2016-11-30。",
    "source_type": "institutional",
    "access": "direct-read",
    "accessed": "2026-09-16",
    "original_excerpt": "项目全称\"二十四节气——中国人通过观察太阳周年运动而形成的时间知识体系及其实践\"；2006年列入第一批国家级非遗名录；2011年九华立春祭、班春劝农、石阡说春列入扩展名录；2014年三门祭冬、壮族霜降节、苗族赶秋、安仁赶分社列入扩展名录；决议于2016年11月30日在亚的斯亚贝巴举行的第十一届政府间委员会常会通过。",
    "locator": "报道正文；届会地点埃塞俄比亚亚的斯亚贝巴，会议期2016-11-28至12-02。",
    "ai_summary": "国家通讯社通稿，给出入选日期、届会、项目全称、国家级非遗与扩展项目时间线，以及\"形成于黄河流域、以天象气温降水物候时序变化为观察基准\"的描述。",
    "rights": "新华社版权所有；仅引用事实要点与短摘录。",
    "verification": "human-verified"
  },
  {
    "id": "source-ihchina-jiuhua-lichunji",
    "title": "农历二十四节气（九华立春祭）项目页",
    "authors": [
      "中国非物质文化遗产网·中国非物质文化遗产数字博物馆"
    ],
    "publisher": "中国艺术研究院（中国非物质文化遗产保护中心）",
    "published": null,
    "url": "https://www.ihchina.cn/project_details/15060.html",
    "citation": "中国非物质文化遗产网：\"农历二十四节气（九华立春祭）\"，2011年第三批国家级非遗扩展项目，编号Ⅹ-68，浙江省衢州市柯城区。",
    "source_type": "institutional",
    "access": "direct-read",
    "accessed": "2026-09-16",
    "original_excerpt": "以农历立春日为祭祀日，九华梧桐祖殿是立春祭主要活动场所。主要活动有：祭拜春神句芒、迎春接福赐求五谷丰登、供祭品、扮芒神、焚香迎奉、扎春牛、演戏酬神、踏青、鞭春牛等。鞭春牛是整个立春祭活动的重要环节，由选定的人装扮成芒神鞭打春牛。",
    "locator": "项目详情页正文\"基本信息\"与\"主要内容\"部分；项目序号516，保护单位衢州市柯城区文化馆。",
    "ai_summary": "国家级非遗权威机构项目页，确认九华立春祭的申报地、批次、类别（民俗）与仪式构成，鞭春牛为核心环节，与劝农春耕相关联。",
    "rights": "网站版权所有；仅引用事实要点与短摘录。",
    "verification": "human-verified"
  }
]