[
  {
    "id": "source-pmo-almanac-qa",
    "title": "历书科普问题解答",
    "authors": [
      "中国科学院紫金山天文台"
    ],
    "publisher": "紫金山天文台官网科普动态",
    "published": "2022-03-17",
    "url": "http://www.pmo.cas.cn/xwdt2019/kpdt2019/202203/t20220317_6399980.html",
    "citation": "中国科学院紫金山天文台：《历书科普问题解答》，2022-03-17。",
    "source_type": "institutional",
    "access": "direct-read",
    "accessed": "2026-09-16",
    "original_excerpt": "一年的二十四节气，反映了地球在绕太阳运行轨道上的不同位置，属于阳历范畴。在阳历中节气日期变化不大，但在农历中节气日期却非常不固定。……农历闰月的安排是人为的规定……取其中最先出现的一个不包含中气（即雨水……）的农历月为闰月。",
    "locator": "\"为什么农历有的月份没有中气\"等问答条目；页面另含农历月大小、年三十有无、双立春/无立春等解答。",
    "ai_summary": "中国历法权威计算机构（紫金山天文台编算《中国天文年历》）的科普问答：节气属阳历成分、农历为阴阳合历；朔日定初一；冬至定十一月；两冬至间含13个朔望月则置闰、取首个无中气之月；节气日期公历稳定、农历漂移的原因；立春2月4日左右与春节1月21日-2月20日变动可产生双立春/无立春年。",
    "rights": "机构官网公开内容；仅引用要点与短摘录。",
    "verification": "human-verified"
  },
  {
    "id": "source-hko-solar-terms",
    "title": "The 24 Solar Terms",
    "authors": [
      "Hong Kong Observatory"
    ],
    "publisher": "Hong Kong Observatory",
    "published": "2020-05-18 (page revision)",
    "url": "https://www.hko.gov.hk/en/gts/time/24solarterms.htm",
    "citation": "Hong Kong Observatory. The 24 Solar Terms. Calendar; revision 18 May 2020.",
    "source_type": "institutional",
    "access": "direct-read",
    "accessed": "2026-09-16",
    "original_excerpt": "The 24 solar terms divide the ecliptic into 24 equal segments, with 15 degrees of the Sun's longitude between the terms.",
    "locator": "Paragraph beginning From the Earth's perspective; next paragraph discusses regional climate and agriculture.",
    "ai_summary": "页面介绍黄经15度分段、节气名称与天气农业经验，并限定为古代中国中部气候的部分反映。",
    "rights": "Source retains rights; metadata and limited excerpt only; no image reuse.",
    "verification": "human-verified"
  },
  {
    "id": "source-ihchina-qiufen-feature",
    "title": "桂子飘香远——二十四节气之秋分（节气专题）",
    "authors": [
      "中国非物质文化遗产网·中国非物质文化遗产数字博物馆（编者整理，编辑李楠）"
    ],
    "publisher": "中国艺术研究院（中国非物质文化遗产保护中心）",
    "published": "2017-09-22",
    "url": "https://www.ihchina.cn/solar_details/6976.html",
    "citation": "中国非物质文化遗产网：《桂子飘香远——二十四节气之秋分》，节气专题页，2026-09-16 读取。",
    "source_type": "institutional",
    "access": "direct-read",
    "accessed": "2026-09-16",
    "original_excerpt": "秋分，农历二十四节气中的第16个节气，太阳在这一天到达黄经180°，直射地球赤道，因此这一天24小时昼夜均分，全球无极昼极夜现象。……按照《春秋繁露·阴阳出入上下篇》所记：\"秋分者，阴阳相半也，故昼夜均而寒暑平。\"……秋分之后，北极附近极夜范围渐大，南极附近极昼范围渐大。今年的秋分时间为2017年9月23日（农历丁酉年八月初四）。……\"一候雷始收声；二候蛰虫坯户；三候水始涸。\"……秋分曾是传统的\"祭月节\"。……周代有两分祭日月之说，即春分祭日、秋分祭月。北京的月坛就是明清皇帝祭月的地方。《礼记》载：\"天子春朝日，秋夕月。朝日之朝，夕月之夕。\"……\"白露早，寒露迟，秋分种麦正当时\"……\"秋分到，蛋儿俏\"。在每年秋分这一天，各地都会有人做\"竖蛋\"游戏。",
    "locator": "\"节气概说\"\"农事农谚\"\"节气习俗\"（祭月/走社/竖蛋/送秋牛/吃秋菜/粘雀子嘴）\"节气养生\"各节；页面经302跳转至 Article/Index/detail?id=9827。",
    "ai_summary": "国家级非遗机构秋分专题：定义（第16个节气、黄经180°、直射赤道、24小时昼夜均分、全球无极昼极夜）、引《春秋繁露》\"阴阳相半\"、三候、气候（长江流域及以北日均温降至22℃以下入秋）、三秋大忙与农谚群（华北种麦、江南稻作、秋分寒）、祭月节叙事（周代两分祭日月、北京月坛、礼记引文）、走社/竖蛋/送秋牛/吃秋菜（岭南秋汤）/粘雀子嘴/南京桂花鸭、养生（秋冻、食蟹）。",
    "rights": "页面声明\"部分图文内容来自网络，经编者整理\"——引用需谨慎，配图一律不用。",
    "verification": "human-verified"
  },
  {
    "id": "source-xinhua-qiufen-2022",
    "title": "秋分说\"分\"",
    "authors": [
      "新华社记者邱冰清、王珏玢（引中科院紫金山天文台科普部主任张旸、南京信息工程大学副教授江晓东）"
    ],
    "publisher": "新华网",
    "published": "2022-09-23",
    "url": "http://www.news.cn/politics/2022-09/23/c_1129025790.htm",
    "citation": "新华社：《秋分说\"分\"》，2022-09-23，记者邱冰清、王珏玢。",
    "source_type": "institutional",
    "access": "direct-read",
    "accessed": "2026-09-16",
    "original_excerpt": "秋分时，太阳直射赤道，昼夜平分。……《中国天文年历》显示，9月23日9时4分迎来秋分节气。……张旸介绍，太阳沿着黄道运行一周共360度，每\"走过\"15度，就迎来一个新节气。\"秋分是指太阳沿着黄道『走到』180度的时刻。\"……张旸说：\"秋分中的『分』与春分一样，指昼夜平分。\"\"春分日、秋分日仍是一年中昼夜最均分的两天。\"……江晓东说：\"秋分是秋季的第四个节气，一个分字也有平分秋季之意。\"\"此时我国大部分地区气温相较白露时明显降低，长江中下游地区开始进入气象学上的秋天。\"……\"一场秋雨一场寒\"。",
    "locator": "全文（专家引语段）；发布时间2022-09-23 11:05。",
    "ai_summary": "新华社2022秋分稿，权威性来自受访机构：紫金山天文台科普部主任张旸给出黄经口径（黄道360度、每15度一节气、秋分=180度时刻、春分秋分是一年中昼夜最均分的两天）与2022年交节时刻（《中国天文年历》9月23日9时4分）；南信大江晓东给出气象口径（秋季第四个节气、平分秋季、长江中下游进入气象学秋天、一场秋雨一场寒）。",
    "rights": "新华社版权稿件；仅引用要点与短摘录。",
    "verification": "human-verified"
  },
  {
    "id": "source-yueling-qishierhou-wikisource",
    "title": "月令七十二候集解（维基文库全文）",
    "authors": [
      "传统题名：吴澄"
    ],
    "publisher": "Wikisource（维基文库）",
    "published": null,
    "url": "https://zh.wikisource.org/wiki/月令七十二候集解",
    "citation": "《月令七十二候集解》，传统题名（元）吴澄撰，维基文库全文本，2026-09-16 读取。",
    "source_type": "historical",
    "access": "direct-read",
    "accessed": "2026-09-16",
    "original_excerpt": "立春，正月節。立，建始也。五行之氣往者過來者續于此。而春木之氣始至，故謂之立也。立夏、秋、冬同。……東風解凍。凍結于冬，遇春風而解散……蟄蟲始振。蟄，藏也；振，動也。密藏之蟲，因氣至，而皆蘇動之矣……魚陟負冰。陟，升也。魚當盛寒伏水底而遂暖，至正月陽氣至，則上遊而近冰，故曰負。",
    "locator": "全书第一节\"立春\"，维基文库全文页；三候条目依次位于立春节之内。",
    "ai_summary": "该书将立春列为全书首节，给出\"立，建始也\"的定义，并按五日一候列立春三候：东风解冻、蛰虫始振、鱼陟负冰，各附简注。紧随其后为雨水节。",
    "rights": "原文属公有领域古籍；维基文库文本依其站点许可提供。仅记录元数据与短摘录。",
    "verification": "human-verified"
  },
  {
    "id": "source-xinhua-qiufen-2024",
    "title": "文化中国行·诗意节令｜秋分：昼夜平分日 寒暑交替时",
    "authors": [
      "新华社记者杨金志、郭慕清"
    ],
    "publisher": "新华网",
    "published": "2024-09-22",
    "url": "http://www.news.cn/20240922/a7246699b4304e77bfd648395eadf7d7/c.html",
    "citation": "新华社：《秋分：昼夜平分日 寒暑交替时》（文化中国行·诗意节令），2024-09-22，记者杨金志、郭慕清。",
    "source_type": "institutional",
    "access": "direct-read",
    "accessed": "2026-09-16",
    "original_excerpt": "太阳在这一天到达黄经180度，直射地球赤道，昼夜各12小时。……何为秋\"分\"？一曰：昼夜平分。……二曰：秋季平分。按农历来讲，立秋为秋季开始，霜降为秋季结束，秋分在中间。……春分后白天越来越长，夏至时到极限；秋分后夜晚越来越长，冬至时到极限。……一候雷始收声，二候蛰虫坯户，三候水始涸。……自2018年起，我国将每年农历秋分设立为\"中国农民丰收节\"。……秋分时很多传统民俗，也都饱含期盼风调雨顺、庄稼丰收的意思，比如，祭月、竖蛋、送秋牛图等。……秋分时节还是收获稻谷、玉米、大豆等农作物的重要时期。",
    "locator": "导语与\"何为秋分\"\"三候\"\"民俗\"\"丰收\"各段；发布时间2024-09-22 11:01，电头\"新华社上海9月22日电\"。",
    "ai_summary": "新华社2024秋分科普文化稿：黄经180度、直射赤道、昼夜各12小时；\"分\"二义（昼夜平分/平分秋季）；引《春秋繁露》《月令七十二候集解》；三候；秋分后夜晚渐长至冬至极限；祭月、竖蛋、送秋牛图等民俗与丰收期盼；稻谷玉米大豆收获期；2018年起农历秋分为中国农民丰收节。",
    "rights": "新华社版权稿件；仅引用要点与短摘录。",
    "verification": "human-verified"
  },
  {
    "id": "source-wikisource-liji-jiyi",
    "title": "禮記/祭義",
    "authors": [
      "《礼记》编者（传统题名戴圣辑）"
    ],
    "publisher": "维基文库",
    "published": null,
    "url": "https://zh.wikisource.org/wiki/禮記/祭義",
    "citation": "《礼记·祭义》，维基文库本，2026-09-16 读取。",
    "source_type": "historical",
    "access": "direct-read",
    "accessed": "2026-09-16",
    "original_excerpt": "郊之祭，大報天而主日，配以月。夏後氏祭其闇，殷人祭其陽，周人祭日，以朝及闇。祭日於壇，祭月於坎；以別幽明，以製上下。祭日於東，祭月於西；以別外內，以端其位。日出於東，月生於西。陰陽長短，終始相巡，以致天下之和。",
    "locator": "《祭义》篇郊祭段。",
    "ai_summary": "《礼记·祭义》确立日月在国家祭祀中的对偶配置：郊祭\"主日配月\"，祭日于坛（春/东）、祭月于坎（秋/西），以别幽明外内。注意：本篇直读文本中**没有**\"天子春朝日，秋夕月\"字句（该句出自汉应劭注《汉书》等，见 [[04_sources/source-wikisource-jingkang-xiyue|靖康缃素杂记引]]）；\"春分朝日、秋分夕月\"的时点对应是经疏（周礼疏/礼记疏）的诠释，见 [[04_sources/source-wikisource-wxtk-jiriyue|文献通考引疏]]。",
    "rights": "维基文库（公众领域古籍，CC BY-SA 4.0 文本层）。",
    "verification": "human-verified"
  },
  {
    "id": "source-wikisource-wxtk-jiriyue",
    "title": "文獻通考/卷七十九（郊社考十二·祭日月）",
    "authors": [
      "马端临（元）"
    ],
    "publisher": "维基文库",
    "published": null,
    "url": "https://zh.wikisource.org/wiki/文獻通考/卷七十九",
    "citation": "马端临：《文献通考》卷七十九《郊社考十二·祭日月》，维基文库本，2026-09-16 读取。",
    "source_type": "historical",
    "access": "direct-read",
    "accessed": "2026-09-16",
    "original_excerpt": "○祭日月……天子常春分朝日，秋分夕月。……傳：王宮，祭日也；夜明，祭月也……疏曰：\"夜明者，祭月壇名也。月明於夜，故謂其壇為夜明也。\"……郊之祭，大報天而主日，配以月……祭日於壇，祭月於坎，以別幽明，以制上下。……疏曰：\"此經及下經，皆據春分朝日，秋分夕月。祭日於壇，謂春分也；祭月於坎，謂秋分也。\"祭日於東，祭月於西，以別外內，以端其位。",
    "locator": "卷七十九《郊社考十二》\"祭日月\"门（首段为《周礼》经注疏辑录）。",
    "ai_summary": "《文献通考》\"祭日月\"门辑录《周礼》经注疏与《礼记》：①\"天子常春分朝日，秋分夕月\"（礼经注疏传统的标准句）；②《祭法》\"王宮，祭日也；夜明，祭月也\"及疏\"夜明者，祭月壇名也\"——\"夜明\"即祭月坛之名；③礼记疏明言\"祭日於壇，謂春分也；祭月於坎，謂秋分也\"——把坛坎祭祀与二分时点对应起来。这是\"秋分祭月\"礼制谱系的关键中间文献。",
    "rights": "维基文库（公众领域古籍，CC BY-SA 4.0 文本层）。",
    "verification": "human-verified"
  },
  {
    "id": "source-xinhua-unesco-solarterms",
    "title": "二十四节气入选《人类非物质文化遗产代表名录》",
    "authors": [
      "新华社记者"
    ],
    "publisher": "新华网",
    "published": "2016-11-30",
    "url": "http://www.xinhuanet.com/politics/2016-11/30/c_129385180.htm",
    "citation": "新华社：《\"二十四节气\"入选联合国教科文组织人类非物质文化遗产代表作名录》，2016-11-30。",
    "source_type": "institutional",
    "access": "direct-read",
    "accessed": "2026-09-16",
    "original_excerpt": "项目全称\"二十四节气——中国人通过观察太阳周年运动而形成的时间知识体系及其实践\"；2006年列入第一批国家级非遗名录；2011年九华立春祭、班春劝农、石阡说春列入扩展名录；2014年三门祭冬、壮族霜降节、苗族赶秋、安仁赶分社列入扩展名录；决议于2016年11月30日在亚的斯亚贝巴举行的第十一届政府间委员会常会通过。",
    "locator": "报道正文；届会地点埃塞俄比亚亚的斯亚贝巴，会议期2016-11-28至12-02。",
    "ai_summary": "国家通讯社通稿，给出入选日期、届会、项目全称、国家级非遗与扩展项目时间线，以及\"形成于黄河流域、以天象气温降水物候时序变化为观察基准\"的描述。",
    "rights": "新华社版权所有；仅引用事实要点与短摘录。",
    "verification": "human-verified"
  },
  {
    "id": "source-ihchina-jiuhua-lichunji",
    "title": "农历二十四节气（九华立春祭）项目页",
    "authors": [
      "中国非物质文化遗产网·中国非物质文化遗产数字博物馆"
    ],
    "publisher": "中国艺术研究院（中国非物质文化遗产保护中心）",
    "published": null,
    "url": "https://www.ihchina.cn/project_details/15060.html",
    "citation": "中国非物质文化遗产网：\"农历二十四节气（九华立春祭）\"，2011年第三批国家级非遗扩展项目，编号Ⅹ-68，浙江省衢州市柯城区。",
    "source_type": "institutional",
    "access": "direct-read",
    "accessed": "2026-09-16",
    "original_excerpt": "以农历立春日为祭祀日，九华梧桐祖殿是立春祭主要活动场所。主要活动有：祭拜春神句芒、迎春接福赐求五谷丰登、供祭品、扮芒神、焚香迎奉、扎春牛、演戏酬神、踏青、鞭春牛等。鞭春牛是整个立春祭活动的重要环节，由选定的人装扮成芒神鞭打春牛。",
    "locator": "项目详情页正文\"基本信息\"与\"主要内容\"部分；项目序号516，保护单位衢州市柯城区文化馆。",
    "ai_summary": "国家级非遗权威机构项目页，确认九华立春祭的申报地、批次、类别（民俗）与仪式构成，鞭春牛为核心环节，与劝农春耕相关联。",
    "rights": "网站版权所有；仅引用事实要点与短摘录。",
    "verification": "human-verified"
  }
]