[
  {
    "id": "source-pmo-almanac-qa",
    "title": "历书科普问题解答",
    "authors": [
      "中国科学院紫金山天文台"
    ],
    "publisher": "紫金山天文台官网科普动态",
    "published": "2022-03-17",
    "url": "http://www.pmo.cas.cn/xwdt2019/kpdt2019/202203/t20220317_6399980.html",
    "citation": "中国科学院紫金山天文台：《历书科普问题解答》，2022-03-17。",
    "source_type": "institutional",
    "access": "direct-read",
    "accessed": "2026-09-16",
    "original_excerpt": "一年的二十四节气，反映了地球在绕太阳运行轨道上的不同位置，属于阳历范畴。在阳历中节气日期变化不大，但在农历中节气日期却非常不固定。……农历闰月的安排是人为的规定……取其中最先出现的一个不包含中气（即雨水……）的农历月为闰月。",
    "locator": "\"为什么农历有的月份没有中气\"等问答条目；页面另含农历月大小、年三十有无、双立春/无立春等解答。",
    "ai_summary": "中国历法权威计算机构（紫金山天文台编算《中国天文年历》）的科普问答：节气属阳历成分、农历为阴阳合历；朔日定初一；冬至定十一月；两冬至间含13个朔望月则置闰、取首个无中气之月；节气日期公历稳定、农历漂移的原因；立春2月4日左右与春节1月21日-2月20日变动可产生双立春/无立春年。",
    "rights": "机构官网公开内容；仅引用要点与短摘录。",
    "verification": "human-verified"
  },
  {
    "id": "source-hko-solar-terms",
    "title": "The 24 Solar Terms",
    "authors": [
      "Hong Kong Observatory"
    ],
    "publisher": "Hong Kong Observatory",
    "published": "2020-05-18 (page revision)",
    "url": "https://www.hko.gov.hk/en/gts/time/24solarterms.htm",
    "citation": "Hong Kong Observatory. The 24 Solar Terms. Calendar; revision 18 May 2020.",
    "source_type": "institutional",
    "access": "direct-read",
    "accessed": "2026-09-16",
    "original_excerpt": "The 24 solar terms divide the ecliptic into 24 equal segments, with 15 degrees of the Sun's longitude between the terms.",
    "locator": "Paragraph beginning From the Earth's perspective; next paragraph discusses regional climate and agriculture.",
    "ai_summary": "页面介绍黄经15度分段、节气名称与天气农业经验，并限定为古代中国中部气候的部分反映。",
    "rights": "Source retains rights; metadata and limited excerpt only; no image reuse.",
    "verification": "human-verified"
  },
  {
    "id": "source-xinhua-xiazhi-2026",
    "title": "星空有约丨有关夏至日的一个真\"最\"和三个假\"最\"（新华社）",
    "authors": [
      "新华社国内部、新华社江苏分社联合制作（记者王珏玢、邱冰清；策划陈聪）"
    ],
    "publisher": "新华网 news.cn",
    "published": "2026-06-20",
    "url": "https://www.news.cn/20260620/63aacb45e4b74a6eaca64a33f7e3f271/c.html",
    "citation": "新华社：《星空有约丨有关夏至日的一个真\"最\"和三个假\"最\"》，2026-06-20，受访专家王科超（中国科学院紫金山天文台科普主管）。",
    "source_type": "institutional",
    "access": "direct-read",
    "accessed": "2026-09-16",
    "original_excerpt": "天文学上，夏至是指太阳在黄道上运行到距天赤道最北处的时刻，此时太阳直射在地球北回归线，夏至所在这天称为夏至日。……夏至日，北半球白昼最长。……以北京地区为例，今年夏至当天，4时46分日出，19时47分日落，白昼长达约15小时。……越往北白昼越长，黑龙江漠河白昼可达约17小时，北极圈内则会出现极昼。……然而，白昼最长并不意味着日出最早、日落最晚。……以真实太阳运动为依据而确定的时间叫真太阳时。……在真太阳时系统中，夏至这天确实是日出最早、日落最晚。……由于地球绕日公转的轨道为椭圆，加上黄赤交角的影响，太阳在天球上并非匀速运动。……不过一般来说，最早日出在夏至前，最晚日落在夏至后。……此外，夏至并非全年气温最高的一天。……直到处暑节气前后，地面散发的热量开始大于其吸收的热量，温度才会逐渐下降。",
    "locator": "全文（定义段、真\"最\"段、假\"最\"一二段（真太阳时/平太阳时机制）、假\"最\"三段（热量收支））。",
    "ai_summary": "新华社2026年夏至科普稿，受访专家为中科院紫金山天文台科普主管王科超：夏至=太阳在黄道上运行到距天赤道最北处的时刻、直射北回归线；真\"最\"=北半球白昼最长（2026年北京夏至白昼约15小时、漠河约17小时、北极圈极昼）；假\"最\"一=非日出最早（最早日出一般在夏至前）；假\"最\"二=非日落最晚（最晚日落在夏至后）——机制为真太阳时与平太阳时之差（地球椭圆轨道+黄赤交角使太阳视运动非匀速）；假\"最\"三=非全年最热（热量收支盈余持续到处暑前后转折）。",
    "rights": "机构媒体公开报道；仅引用要点与短摘录。",
    "verification": "human-verified"
  },
  {
    "id": "source-weathercn-xiazhi-feature",
    "title": "二十四节气之夏至（中国天气网）",
    "authors": [
      "中国天气网（中国气象局主办）"
    ],
    "publisher": "中国天气网 weather.com.cn（天津频道转载页）",
    "published": null,
    "url": "https://www.weather.com.cn/tianjin/tqyw/06/3473896.shtml",
    "citation": "中国天气网：《二十四节气之夏至》，2026-09-16 读取。",
    "source_type": "institutional",
    "access": "direct-read",
    "accessed": "2026-09-16",
    "original_excerpt": "夏至是二十四节气之一，每年公历6月21日或22日视太阳运行至黄经90度为夏至，此时太阳直射地面的位置到达一年的最北端，几乎直射北回归线，北半球的日照时间最长。……\"不过夏至不热\"，\"夏至三庚数头伏\"。夏至虽表示炎热的夏天已经到来，但还不是最热的时候，夏至后的一段时间内气温仍继续升高，大约再过二三十天，一般是最热的天气了。……中国古人将夏至分为三候：一候鹿角解，二候蝉始鸣，三候半夏生。",
    "locator": "页面首段定义句；\"不过夏至不热\"\"夏至三庚数头伏\"气温段；三候段；习俗段（\"夏至节\"祭神祀祖、消夏避伏、吃面条、食粽子）。",
    "ai_summary": "中国气象局体系机构稿的夏至天文定义（黄经90°、公历6月21或22日、直射最北端近北回归线、北半球日照时间最长——本页措辞为\"日照时间最长\"）；气温机制（夏至非最热、再过二三十天到最热，即入伏铺垫）；三候；\"夏至节\"习俗概述（祭神祀祖/消夏避伏/吃面条/食粽子）。页面另含养生常识段（清淡饮食、苦味菜、绿豆汤），按养生建议对待不作文化事实。",
    "rights": "机构官网公开内容；仅引用要点与短摘录。",
    "verification": "human-verified"
  },
  {
    "id": "source-yueling-qishierhou-wikisource",
    "title": "月令七十二候集解（维基文库全文）",
    "authors": [
      "传统题名：吴澄"
    ],
    "publisher": "Wikisource（维基文库）",
    "published": null,
    "url": "https://zh.wikisource.org/wiki/月令七十二候集解",
    "citation": "《月令七十二候集解》，传统题名（元）吴澄撰，维基文库全文本，2026-09-16 读取。",
    "source_type": "historical",
    "access": "direct-read",
    "accessed": "2026-09-16",
    "original_excerpt": "立春，正月節。立，建始也。五行之氣往者過來者續于此。而春木之氣始至，故謂之立也。立夏、秋、冬同。……東風解凍。凍結于冬，遇春風而解散……蟄蟲始振。蟄，藏也；振，動也。密藏之蟲，因氣至，而皆蘇動之矣……魚陟負冰。陟，升也。魚當盛寒伏水底而遂暖，至正月陽氣至，則上遊而近冰，故曰負。",
    "locator": "全书第一节\"立春\"，维基文库全文页；三候条目依次位于立春节之内。",
    "ai_summary": "该书将立春列为全书首节，给出\"立，建始也\"的定义，并按五日一候列立春三候：东风解冻、蛰虫始振、鱼陟负冰，各附简注。紧随其后为雨水节。",
    "rights": "原文属公有领域古籍；维基文库文本依其站点许可提供。仅记录元数据与短摘录。",
    "verification": "human-verified"
  },
  {
    "id": "source-ihchina-xiazhi-feature",
    "title": "冰雪在心——二十四节气之夏至（节气专题）",
    "authors": [
      "中国非物质文化遗产网·中国非物质文化遗产数字博物馆（编者整理）"
    ],
    "publisher": "中国艺术研究院（中国非物质文化遗产保护中心）",
    "published": null,
    "url": "https://www.ihchina.cn/solar_details/6970.html",
    "citation": "中国非物质文化遗产网：《冰雪在心——二十四节气之夏至》，节气专题页，2026-09-16 读取。",
    "source_type": "institutional",
    "access": "direct-read",
    "accessed": "2026-09-16",
    "original_excerpt": "夏至是二十四节气中的第十个节气。每年6月21日或22日是夏至日，此时太阳直射地面的位置到达一年的最北端，几乎直射北回归线，此时北半球的白昼最长，且越往北越长。今年的夏至时间是6月21日（农历丁酉年五月廿七日）。……夏至三候：一候鹿角解；二候蝉始鸣；三候半夏生。……古时夏至日，人们通过祭神以祈求灾消年丰。根据《史记·封禅书》记载：\"夏至日，祭地，皆用乐舞。\"周代夏至祭神，意在清除疫疠与饥馑。……夏至后进入伏天。……\"夏至三庚数头伏\"……山东各地普遍要吃凉面条，俗称过水面……无锡人早晨吃麦粥，中午吃馄饨……漠河是中国纬度最高的县份，因纬度高，夏至前后会产生极昼现象，白昼达17个小时以上，午夜北眺，天边泛白，西边晚霞未落，东方朝晖又升，这种\"白夜\"景象是漠河县特有的旅游景观。",
    "locator": "\"节气概说\"\"夏至三候\"\"夏至祭祀、祭神\"\"夏至农事\"\"夏至习俗\"\"夏至养生\"各节；地域条目含山东过水面、莱阳荐新麦、绍兴做夏至、无锡麦粥馄饨、漠河极昼等。",
    "ai_summary": "国家级非遗机构夏至专题：定义（第十个节气、6月21或22日、太阳直射最北端近北回归线、北半球白昼最长越往北越长、2017年夏至为6月21日农历五月廿七）、三候（鹿角解/蝉始鸣/半夏生，措辞作\"蝉\"不作\"蜩\"）、《史记·封禅书》祭地引文（实为转写，与原文\"夏日至，祭地祗\"有措辞差）、\"夏至三庚数头伏\"三伏机制（第三庚初伏/第四庚中伏/立秋后第一庚末伏）、农谚群、南北食俗（夏至面、山东过水面、莱阳黄县新麦、绍兴蒲丝饼、无锡馄饨、儿童称重）、漠河极昼旅游景观。",
    "rights": "页面尾注\"（部分图文内容来自网络，经编者整理。）\"——引用需谨慎，配图一律不用。",
    "verification": "human-verified"
  },
  {
    "id": "source-wikisource-yanjingsuishiji",
    "title": "燕京歲時記（维基文库全文）",
    "authors": [
      "富察敦崇（清）"
    ],
    "publisher": "Wikisource（维基文库）",
    "published": null,
    "url": "https://zh.wikisource.org/wiki/燕京歲時記",
    "citation": "富察敦崇：《燕京岁时记》，维基文库全文本，2026-09-16 读取。",
    "source_type": "historical",
    "access": "direct-read",
    "accessed": "2026-09-16",
    "original_excerpt": "打春即立春，在正月者居多。立春先一日，順天府官員至東直門外一里春場迎春。立春日，禮部呈進春山寶座，順天府呈進春牛圖。禮畢回署，引春牛而擊之，曰打春。……是日富家多食春餅，婦女等多買羅卜而食之，曰咬春，謂可以卻春困也。",
    "locator": "\"打春\"条（正月部分，目录编号1.7，\"咬春\"内容在该条内非独立条目）；条后\"謹按\"引《禮部則例》述官方迎春礼仪。",
    "ai_summary": "清末北京岁时志：立春前一日顺天府官员赴东直门外春场迎春，立春日礼部进春山宝座、顺天府进春牛图、击春牛曰打春（官方礼仪）；当日富家食春饼、妇女买萝卜食之曰咬春\"谓可以卻春困\"。咬春不独立成条，系于打春条内。",
    "rights": "原文属公有领域古籍；维基文库文本依其站点许可。仅记录元数据与短摘录。",
    "verification": "human-verified"
  },
  {
    "id": "source-xinhua-unesco-solarterms",
    "title": "二十四节气入选《人类非物质文化遗产代表名录》",
    "authors": [
      "新华社记者"
    ],
    "publisher": "新华网",
    "published": "2016-11-30",
    "url": "http://www.xinhuanet.com/politics/2016-11/30/c_129385180.htm",
    "citation": "新华社：《\"二十四节气\"入选联合国教科文组织人类非物质文化遗产代表作名录》，2016-11-30。",
    "source_type": "institutional",
    "access": "direct-read",
    "accessed": "2026-09-16",
    "original_excerpt": "项目全称\"二十四节气——中国人通过观察太阳周年运动而形成的时间知识体系及其实践\"；2006年列入第一批国家级非遗名录；2011年九华立春祭、班春劝农、石阡说春列入扩展名录；2014年三门祭冬、壮族霜降节、苗族赶秋、安仁赶分社列入扩展名录；决议于2016年11月30日在亚的斯亚贝巴举行的第十一届政府间委员会常会通过。",
    "locator": "报道正文；届会地点埃塞俄比亚亚的斯亚贝巴，会议期2016-11-28至12-02。",
    "ai_summary": "国家通讯社通稿，给出入选日期、届会、项目全称、国家级非遗与扩展项目时间线，以及\"形成于黄河流域、以天象气温降水物候时序变化为观察基准\"的描述。",
    "rights": "新华社版权所有；仅引用事实要点与短摘录。",
    "verification": "human-verified"
  },
  {
    "id": "source-ihchina-jiuhua-lichunji",
    "title": "农历二十四节气（九华立春祭）项目页",
    "authors": [
      "中国非物质文化遗产网·中国非物质文化遗产数字博物馆"
    ],
    "publisher": "中国艺术研究院（中国非物质文化遗产保护中心）",
    "published": null,
    "url": "https://www.ihchina.cn/project_details/15060.html",
    "citation": "中国非物质文化遗产网：\"农历二十四节气（九华立春祭）\"，2011年第三批国家级非遗扩展项目，编号Ⅹ-68，浙江省衢州市柯城区。",
    "source_type": "institutional",
    "access": "direct-read",
    "accessed": "2026-09-16",
    "original_excerpt": "以农历立春日为祭祀日，九华梧桐祖殿是立春祭主要活动场所。主要活动有：祭拜春神句芒、迎春接福赐求五谷丰登、供祭品、扮芒神、焚香迎奉、扎春牛、演戏酬神、踏青、鞭春牛等。鞭春牛是整个立春祭活动的重要环节，由选定的人装扮成芒神鞭打春牛。",
    "locator": "项目详情页正文\"基本信息\"与\"主要内容\"部分；项目序号516，保护单位衢州市柯城区文化馆。",
    "ai_summary": "国家级非遗权威机构项目页，确认九华立春祭的申报地、批次、类别（民俗）与仪式构成，鞭春牛为核心环节，与劝农春耕相关联。",
    "rights": "网站版权所有；仅引用事实要点与短摘录。",
    "verification": "human-verified"
  }
]