[
  {
    "id": "source-pmo-almanac-qa",
    "title": "历书科普问题解答",
    "authors": [
      "中国科学院紫金山天文台"
    ],
    "publisher": "紫金山天文台官网科普动态",
    "published": "2022-03-17",
    "url": "http://www.pmo.cas.cn/xwdt2019/kpdt2019/202203/t20220317_6399980.html",
    "citation": "中国科学院紫金山天文台：《历书科普问题解答》，2022-03-17。",
    "source_type": "institutional",
    "access": "direct-read",
    "accessed": "2026-09-16",
    "original_excerpt": "一年的二十四节气，反映了地球在绕太阳运行轨道上的不同位置，属于阳历范畴。在阳历中节气日期变化不大，但在农历中节气日期却非常不固定。……农历闰月的安排是人为的规定……取其中最先出现的一个不包含中气（即雨水……）的农历月为闰月。",
    "locator": "\"为什么农历有的月份没有中气\"等问答条目；页面另含农历月大小、年三十有无、双立春/无立春等解答。",
    "ai_summary": "中国历法权威计算机构（紫金山天文台编算《中国天文年历》）的科普问答：节气属阳历成分、农历为阴阳合历；朔日定初一；冬至定十一月；两冬至间含13个朔望月则置闰、取首个无中气之月；节气日期公历稳定、农历漂移的原因；立春2月4日左右与春节1月21日-2月20日变动可产生双立春/无立春年。",
    "rights": "机构官网公开内容；仅引用要点与短摘录。",
    "verification": "human-verified"
  },
  {
    "id": "source-hko-solar-terms",
    "title": "The 24 Solar Terms",
    "authors": [
      "Hong Kong Observatory"
    ],
    "publisher": "Hong Kong Observatory",
    "published": "2020-05-18 (page revision)",
    "url": "https://www.hko.gov.hk/en/gts/time/24solarterms.htm",
    "citation": "Hong Kong Observatory. The 24 Solar Terms. Calendar; revision 18 May 2020.",
    "source_type": "institutional",
    "access": "direct-read",
    "accessed": "2026-09-16",
    "original_excerpt": "The 24 solar terms divide the ecliptic into 24 equal segments, with 15 degrees of the Sun's longitude between the terms.",
    "locator": "Paragraph beginning From the Earth's perspective; next paragraph discusses regional climate and agriculture.",
    "ai_summary": "页面介绍黄经15度分段、节气名称与天气农业经验，并限定为古代中国中部气候的部分反映。",
    "rights": "Source retains rights; metadata and limited excerpt only; no image reuse.",
    "verification": "human-verified"
  },
  {
    "id": "source-ihchina-xiaoman-feature",
    "title": "南风原头吹百草——二十四节气之小满（节气专题）",
    "authors": [
      "中国非物质文化遗产保护中心"
    ],
    "publisher": "中国非物质文化遗产网·中国非物质文化遗产数字博物馆",
    "published": "2017-05-22",
    "url": "https://www.ihchina.cn/solar_details/6968.html",
    "citation": "中国非物质文化遗产网：《南风原头吹百草——二十四节气之小满》，节气专题页（页面跳转至 Article/Index/detail?id=9977），创建于2017-05-22，2026-09-16 读取。",
    "source_type": "institutional",
    "access": "direct-read",
    "accessed": "2026-09-16",
    "original_excerpt": "每年5月20日至22日，太阳到达黄经60°时，是二十四节气之小满节气的开始，今年的小满时间是2017年5月21日（农历丁酉年四月廿六）。《月令七十二候集解》记载：\"四月中，小满者，物至于此小得盈满。\"小满的含义是夏熟作物的籽粒开始灌浆饱满，但还未成熟。……\"小满三候\"：\"一候苦菜秀，二候靡草死，三候麦秋至。\"……农谚\"小满不下，黄梅偏少\"\"小满无雨，芒种无水\"（长江中下游）；\"小满大满江河满\"（华南）；\"小满不满，麦有一险\"（此时黄河中下游地区小麦刚进入灌浆期，最怕干热风的袭击）。……南方地区的农谚赋予小满另一番寓意，\"满\"不仅指农作物的饱满度，也用来形容雨水的盈缺。……祭车神（\"小满动三车\"：三车为水车、油车、丝车；相传\"车神\"为白龙；祭品中有一杯白水，泼入田中，有祈愿水源涌旺的意思）；抢水仪式（流行于浙江海宁一带，黎明群体出动踏水车引河水入田）；祭蚕（相传小满是蚕神诞辰，江浙一带举行祈蚕节）；食苦菜（苦菜是中国人最早食用的野菜之一，宁夏人称\"苦苦菜\"，李时珍称之为\"天香草\"；过去青黄不接之时，百姓用苦菜充饥）。",
    "locator": "\"节气概说\"\"农事农谚\"\"民俗\"各节；养生段（风疹/清淡饮食）无医学出处，本轮不采信。cross-checked 范围仅覆盖两个子命题（黄经60°/5月20-22日对新华社2024稿；《月令》引文对维基文库本）；页内农谚与习俗段未经交叉核验，引用时按机构汇编层处理（2026-09-17 质量修正 F03 注记）。",
    "ai_summary": "国家级非遗机构小满专题：定义（5月20-22日、黄经60°）、2017年交节实例（5月21日，农历四月廿六）、月令引文、三候释义、三夏农事与分地域农谚群（长江中下游/华南/黄河中下游）、南北\"满\"双义（籽粒饱满/雨水盈缺）、祭车神/抢水/祭蚕/食苦菜习俗（\"相传\"层）。",
    "rights": "页面尾注\"部分图文内容来自网络，经编者整理\"——机构发布+编辑汇编性质，农谚与习俗未逐一标注原始出处，引用按 medium 以下对待；配图不用。",
    "verification": "human-verified"
  },
  {
    "id": "source-xinhua-xiaoman-2024",
    "title": "诗意节令丨小满：小得盈满胜万全",
    "authors": [
      "杨金志、郭慕清（记者）"
    ],
    "publisher": "新华社（news.cn）",
    "published": "2024-05-20",
    "url": "http://www.news.cn/local/20240520/6a25490c09e5477e917fb302be89fc41/c.html",
    "citation": "杨金志、郭慕清：《诗意节令丨小满：小得盈满胜万全》，新华社，2024-05-20。",
    "source_type": "institutional",
    "access": "direct-read",
    "accessed": "2026-09-16",
    "original_excerpt": "每年公历5月20日至22日，太阳到达黄经60度，人们迎来节气——小满。……小满是二十四节气的第八个节气，也是夏季第二个节气。《月令七十二候集解》中记载：\"四月中，小满者，物致于此小得盈满。\"此处四月是指阴历四月，这时北方地区的小麦等夏熟作物正籽粒灌浆饱满、将熟未熟。……（设问）\"唯有小满『别具一格』，其后是芒种，没有大满，此为何哉？\"……华东师范大学民俗学研究所教授田兆元说，小满的命名体现了哲学智慧。满则溢、盈则亏，自然之道；物极必反，因此满招损，谦受益。小满，不疾不徐，虽为节气，亦是人生。于生活而言，小满是知足，也是期待。",
    "locator": "导语天文定义段；月令引文与释义段；\"没有大满\"设问与田兆元解答段。",
    "ai_summary": "新华社节气科普稿：黄经60°/公历5月20-22日/第8个节气/夏季第2个；月令引文（作\"物致于此\"）；北方小麦灌浆将熟未熟释义；\"为何无大满\"由民俗学者田兆元作答（当代学者阐释，非古籍）。",
    "rights": "新华社稿，转载需授权；仅引用要点与短摘录。",
    "verification": "human-verified"
  },
  {
    "id": "source-yueling-qishierhou-wikisource",
    "title": "月令七十二候集解（维基文库全文）",
    "authors": [
      "传统题名：吴澄"
    ],
    "publisher": "Wikisource（维基文库）",
    "published": null,
    "url": "https://zh.wikisource.org/wiki/月令七十二候集解",
    "citation": "《月令七十二候集解》，传统题名（元）吴澄撰，维基文库全文本，2026-09-16 读取。",
    "source_type": "historical",
    "access": "direct-read",
    "accessed": "2026-09-16",
    "original_excerpt": "立春，正月節。立，建始也。五行之氣往者過來者續于此。而春木之氣始至，故謂之立也。立夏、秋、冬同。……東風解凍。凍結于冬，遇春風而解散……蟄蟲始振。蟄，藏也；振，動也。密藏之蟲，因氣至，而皆蘇動之矣……魚陟負冰。陟，升也。魚當盛寒伏水底而遂暖，至正月陽氣至，則上遊而近冰，故曰負。",
    "locator": "全书第一节\"立春\"，维基文库全文页；三候条目依次位于立春节之内。",
    "ai_summary": "该书将立春列为全书首节，给出\"立，建始也\"的定义，并按五日一候列立春三候：东风解冻、蛰虫始振、鱼陟负冰，各附简注。紧随其后为雨水节。",
    "rights": "原文属公有领域古籍；维基文库文本依其站点许可提供。仅记录元数据与短摘录。",
    "verification": "human-verified"
  },
  {
    "id": "source-mct-shengze-canfa",
    "title": "乡村四时好风光·江苏·蚕花里太湖东（盛泽先蚕祠）",
    "authors": [
      "中华人民共和国文化和旅游部（专题页编者）"
    ],
    "publisher": "文化和旅游部官网（zhuanti.mct.gov.cn）",
    "published": "2024-07-18",
    "url": "https://zhuanti.mct.gov.cn/xcss2024_xcygj/jiangsu/detail/7257.html",
    "citation": "文化和旅游部：《乡村四时好风光·营造之美 自在乡村》江苏分站\"蚕花里太湖东\"条（盛泽先蚕祠），2024-07-18，2026-09-16 读取。",
    "source_type": "institutional",
    "access": "direct-read",
    "accessed": "2026-09-16",
    "original_excerpt": "（先蚕祠）\"清道光二十年（1840）为祭祀嫘祖而建\"，\"同时也是盛泽镇的丝业公所\"，为\"最具代表性的祭拜蚕神的祠庙和行业公所\"，\"也称蚕花殿或蚕王殿\"。\"古代小满节为蚕神诞辰，在祠内戏台演出小满戏，名闻遐迩。\"另载2024年被评为\"四季村晚\"示范展示点。",
    "locator": "江苏分站盛泽先蚕祠条目。",
    "ai_summary": "文旅部乡村文旅专题对盛泽先蚕祠的权威介绍：道光二十年（1840）建、祭祀嫘祖、兼为丝业公所；小满节为蚕神诞辰、祠内戏台演小满戏；当代仍为活态展示点（2024\"四季村晚\"示范展示点）。未载演戏天数与\"动三车\"。",
    "rights": "政府官网公开内容；仅引用要点与短摘录。",
    "verification": "human-verified"
  },
  {
    "id": "source-ihchina-xiaoman-zheli-2015",
    "title": "小满——一个充满哲理和希望的节气",
    "authors": [
      "中国文化报（原发，作者未署名）；中国非物质文化遗产网转载"
    ],
    "publisher": "中国文化报 / 中国非物质文化遗产网",
    "published": "2015-05-22",
    "url": "https://www.ihchina.cn/news_1_details/10320.html",
    "citation": "中国文化报：《小满——一个充满哲理和希望的节气》，2015-05-22（中国非物质文化遗产网转载页），2026-09-16 读取。",
    "source_type": "cultural",
    "access": "direct-read",
    "accessed": "2026-09-16",
    "original_excerpt": "\"四月中，小满者，物至于此小得盈满。\"在二十四节气中，小满绝对是一个充满哲理的节气。小满者，满而不损也，满而不盈也，满而不溢也。中国传统儒家中庸之道，忌讳\"太满\"\"大满\"，有\"满招损、谦受益\"\"物极必反\"之说。因此在二十四节气的命名上有一个独特的现象，有小暑必有大暑，有小雪必有大雪，有小寒必有大寒，有小满却独缺大满。人生小满，足矣。……抢水：旧时水车车水排灌为农村大事，谚云：\"小满动三车（即丝车、油车、水车）。\"……祈蚕节：小满节相传为蚕神诞辰……据记载，清道光七年（1827年），江南盛泽丝业公所在江苏吴江兴建了先蚕祠，祠内专门筑了戏楼，其广场可容万人观剧。小满前后三天由丝业公所出资，筵请各班登台唱大戏。……江南一带忌在小满前后演出带有私生子和死人情节的戏，因小满相传为蚕神诞辰，\"私\"和\"死\"都是\"丝\"的谐音。……旧时有在小满吃苦菜和尝新麦的习俗，吃\"苦\"尝\"新\"。",
    "locator": "\"哲理\"开篇段；【物候】段；抢水/祭三神/祈蚕节三节。",
    "ai_summary": "文化部机关报小满专文：①\"满而不损/独缺大满/人生小满足矣\"的现代哲理阐释完整文本（现代文化阐释层一手样本）；②动三车谚语转述；③盛泽先蚕祠道光七年（1827）建、演戏三天、祥瑞戏点戏与\"私/死-丝\"谐音演戏禁忌（\"据记载\"，出处未标）；④旧时食苦菜尝新麦。",
    "rights": "文化部机关报文章，非遗网转载页直读；仅引用要点与短摘录。",
    "verification": "human-verified"
  },
  {
    "id": "source-xinhua-unesco-solarterms",
    "title": "二十四节气入选《人类非物质文化遗产代表名录》",
    "authors": [
      "新华社记者"
    ],
    "publisher": "新华网",
    "published": "2016-11-30",
    "url": "http://www.xinhuanet.com/politics/2016-11/30/c_129385180.htm",
    "citation": "新华社：《\"二十四节气\"入选联合国教科文组织人类非物质文化遗产代表作名录》，2016-11-30。",
    "source_type": "institutional",
    "access": "direct-read",
    "accessed": "2026-09-16",
    "original_excerpt": "项目全称\"二十四节气——中国人通过观察太阳周年运动而形成的时间知识体系及其实践\"；2006年列入第一批国家级非遗名录；2011年九华立春祭、班春劝农、石阡说春列入扩展名录；2014年三门祭冬、壮族霜降节、苗族赶秋、安仁赶分社列入扩展名录；决议于2016年11月30日在亚的斯亚贝巴举行的第十一届政府间委员会常会通过。",
    "locator": "报道正文；届会地点埃塞俄比亚亚的斯亚贝巴，会议期2016-11-28至12-02。",
    "ai_summary": "国家通讯社通稿，给出入选日期、届会、项目全称、国家级非遗与扩展项目时间线，以及\"形成于黄河流域、以天象气温降水物候时序变化为观察基准\"的描述。",
    "rights": "新华社版权所有；仅引用事实要点与短摘录。",
    "verification": "human-verified"
  },
  {
    "id": "source-ihchina-jiuhua-lichunji",
    "title": "农历二十四节气（九华立春祭）项目页",
    "authors": [
      "中国非物质文化遗产网·中国非物质文化遗产数字博物馆"
    ],
    "publisher": "中国艺术研究院（中国非物质文化遗产保护中心）",
    "published": null,
    "url": "https://www.ihchina.cn/project_details/15060.html",
    "citation": "中国非物质文化遗产网：\"农历二十四节气（九华立春祭）\"，2011年第三批国家级非遗扩展项目，编号Ⅹ-68，浙江省衢州市柯城区。",
    "source_type": "institutional",
    "access": "direct-read",
    "accessed": "2026-09-16",
    "original_excerpt": "以农历立春日为祭祀日，九华梧桐祖殿是立春祭主要活动场所。主要活动有：祭拜春神句芒、迎春接福赐求五谷丰登、供祭品、扮芒神、焚香迎奉、扎春牛、演戏酬神、踏青、鞭春牛等。鞭春牛是整个立春祭活动的重要环节，由选定的人装扮成芒神鞭打春牛。",
    "locator": "项目详情页正文\"基本信息\"与\"主要内容\"部分；项目序号516，保护单位衢州市柯城区文化馆。",
    "ai_summary": "国家级非遗权威机构项目页，确认九华立春祭的申报地、批次、类别（民俗）与仪式构成，鞭春牛为核心环节，与劝农春耕相关联。",
    "rights": "网站版权所有；仅引用事实要点与短摘录。",
    "verification": "human-verified"
  },
  {
    "id": "source-wikisource-qiminyaoshu",
    "title": "齊民要術（维基文库（十卷本，卷页待逐卷读））",
    "authors": [
      "贾思勰（北魏）"
    ],
    "publisher": "维基文库",
    "published": null,
    "url": "https://zh.wikisource.org/wiki/齊民要術",
    "citation": "贾思勰：《齐民要术》，维基文库，卷第一至卷十，2026-09-25 读取主页目录。",
    "source_type": "historical",
    "access": "direct-read",
    "accessed": "2026-09-25",
    "original_excerpt": "卷十篇名：五穀、果蓏、菜茹非中國物產者（主页目录直读）；耕田第一、收種第二、種穀第三在卷第一。",
    "locator": "主页目录+卷第一全篇（耕田第一/收種第二/種穀第三，2026-09-25逐字直读）；其余卷待后续轮次。",
    "ai_summary": "北魏农书祖本，黄河流域农事时宜的一手来源；十卷结构已直读，农时相关篇（耕田/收种/种谷）在卷第一。R04-R06逐卷读。",
    "rights": "原文公有领域古籍；维基文库文本依其站点许可。仅元数据与短摘录。",
    "verification": "human-verified"
  }
]