[
  {
    "id": "source-pmo-almanac-qa",
    "title": "历书科普问题解答",
    "authors": [
      "中国科学院紫金山天文台"
    ],
    "publisher": "紫金山天文台官网科普动态",
    "published": "2022-03-17",
    "url": "http://www.pmo.cas.cn/xwdt2019/kpdt2019/202203/t20220317_6399980.html",
    "citation": "中国科学院紫金山天文台：《历书科普问题解答》，2022-03-17。",
    "source_type": "institutional",
    "access": "direct-read",
    "accessed": "2026-09-16",
    "original_excerpt": "一年的二十四节气，反映了地球在绕太阳运行轨道上的不同位置，属于阳历范畴。在阳历中节气日期变化不大，但在农历中节气日期却非常不固定。……农历闰月的安排是人为的规定……取其中最先出现的一个不包含中气（即雨水……）的农历月为闰月。",
    "locator": "\"为什么农历有的月份没有中气\"等问答条目；页面另含农历月大小、年三十有无、双立春/无立春等解答。",
    "ai_summary": "中国历法权威计算机构（紫金山天文台编算《中国天文年历》）的科普问答：节气属阳历成分、农历为阴阳合历；朔日定初一；冬至定十一月；两冬至间含13个朔望月则置闰、取首个无中气之月；节气日期公历稳定、农历漂移的原因；立春2月4日左右与春节1月21日-2月20日变动可产生双立春/无立春年。",
    "rights": "机构官网公开内容；仅引用要点与短摘录。",
    "verification": "human-verified"
  },
  {
    "id": "source-hko-solar-terms",
    "title": "The 24 Solar Terms",
    "authors": [
      "Hong Kong Observatory"
    ],
    "publisher": "Hong Kong Observatory",
    "published": "2020-05-18 (page revision)",
    "url": "https://www.hko.gov.hk/en/gts/time/24solarterms.htm",
    "citation": "Hong Kong Observatory. The 24 Solar Terms. Calendar; revision 18 May 2020.",
    "source_type": "institutional",
    "access": "direct-read",
    "accessed": "2026-09-16",
    "original_excerpt": "The 24 solar terms divide the ecliptic into 24 equal segments, with 15 degrees of the Sun's longitude between the terms.",
    "locator": "Paragraph beginning From the Earth's perspective; next paragraph discusses regional climate and agriculture.",
    "ai_summary": "页面介绍黄经15度分段、节气名称与天气农业经验，并限定为古代中国中部气候的部分反映。",
    "rights": "Source retains rights; metadata and limited excerpt only; no image reuse.",
    "verification": "human-verified"
  },
  {
    "id": "source-ihchina-guyu-feature",
    "title": "雨生百谷——二十四节气之谷雨（节气专题）",
    "authors": [
      "飞仪（页面署名作者）",
      "中国非物质文化遗产网（编者整理）"
    ],
    "publisher": "中国艺术研究院（中国非物质文化遗产保护中心）",
    "published": "2017-04-19",
    "url": "https://www.ihchina.cn/solar_details/45.html",
    "citation": "中国非物质文化遗产网：《雨生百谷——二十四节气之谷雨》，节气专题页（创建于2017-04-19），2026-09-16 读取。",
    "source_type": "institutional",
    "access": "direct-read",
    "accessed": "2026-09-16",
    "original_excerpt": "二十四节气的第六个节气是谷雨，也是春季的最后一个节气。此时太阳到达黄经30°，雨水增多，有利于谷类农作物的生长。今年的谷雨时间是4月20日，即农历丁酉年三月廿四日。……中国古代将谷雨分为三候：\"第一候萍始生；第二候鸣鸠拂其羽；第三候为戴胜降于桑。\"（《月令七十二候集解》）……古人说\"雨生百谷\"，这是播种移苗、埯瓜点豆的最佳时节。俗话说\"清明断雪，谷雨断霜\"……南方有谷雨摘茶的习俗。谷雨茶也就是雨前茶……北方有谷雨食香椿的习俗……\"谷雨祭仓颉\"，是自汉代以来流传千年的民间传统。传说仓颉造字后\"天雨谷，鬼夜哭\"，于是有种说法，把仓颉造字这天叫做谷雨，陕西渭南白水县至今流传着谷雨祭祀文祖仓颉的习俗。",
    "locator": "页面分节：一、节气概说；二、农事农谚；三、节气习俗（谷雨茶/食香椿/侗寨谷雨节/渔民节/禁蝎/祭仓颉）；四、节气养生。另含\"谷雨花\"\"谷雨三朝看牡丹\"表述与农谚群、荣成渔民节、清乾隆六年《夏津县志》\"谷雨，朱砂书符禁蝎\"引文。",
    "ai_summary": "国家级非遗机构谷雨专题（2017年稿）：谷雨为第6个节气、春季最后一个、黄经30°、2017年交节4月20日（农历丁酉三月廿四）；三候引《月令七十二候集解》；农事（播种移苗/埯瓜点豆、清明断雪谷雨断霜）与农谚群（流传地域未逐一标明）；习俗含谷雨茶（南方）、食香椿（北方）、侗寨谷雨节（吃乌米/打花脸/播稻种）、荣成渔民节、禁蝎（谷雨帖）、祭仓颉（明确以\"传说\"\"有种说法\"措辞引出，并称\"自汉代以来流传千年\"）。注意：页面自述\"部分文字、图片整理自网络\"，属机构编辑汇编；渔民营\"两千多年历史\"、\"自汉代以来\"等断代表述未给出处，按待核对待。",
    "rights": "页面声明\"（部分文字、图片整理自网络。）\"——引用需谨慎，配图一律不用；断代类表述未标原始出处，引用时降权。",
    "verification": "human-verified"
  },
  {
    "id": "source-xinhua-guyu-2022",
    "title": "节令之美·谷雨丨4月20日10时24分\"谷雨\"：看百谷丛生，听春雨连连",
    "authors": [
      "新华社记者 周润健（报道署名）"
    ],
    "publisher": "新华社（新华网 news.cn）",
    "published": "2022-04-19",
    "url": "http://www.news.cn/2022-04/19/c_1128573401.htm",
    "citation": "新华社：《节令之美·谷雨丨4月20日10时24分\"谷雨\"：看百谷丛生，听春雨连连》，2022-04-19。",
    "source_type": "institutional",
    "access": "direct-read",
    "accessed": "2026-09-16",
    "original_excerpt": "\"谷雨春光晓，山川黛色青\"。当太阳到达黄经30度时，\"谷雨\"节气到了。北京时间4月20日10时24分将迎来\"谷雨\"。……每年公历的4月19日、20日或21日，为\"谷雨\"节气之始，它是二十四节气中第六个节气，也是春季最后一个节气。……\"谷雨\"，寓意\"雨生百谷\"，与\"雨水\"\"小满\"\"小雪\"\"大雪\"一样，都是代表降水状况的节气，也是农耕文化在节令上的反映。……此时节，降水日增，秧苗初插，作物新种，春茶采摘，雨润百谷，万物生长、蒸蒸日上。",
    "locator": "导语与正文前段；历史学者、天津社科院研究员罗澍伟为报道受访专家；开篇引元稹诗句\"谷雨春光晓，山川黛色青\"。",
    "ai_summary": "新华社2022年谷雨交节报道：太阳到达黄经30度、2022年交节时刻4月20日10时24分（北京时间）；交节日期范围\"每年公历的4月19日、20日或21日\"；谷雨为第6个节气、春季最后一个；名称被释为\"寓意雨生百谷\"、降水类节气、\"农耕文化在节令上的反映\"；农事概括\"降水日增，秧苗初插，作物新种，春茶采摘\"。注意：4月19-21日日期范围语句本轮仅此页直读（非遗网页只给2017年实例4月20日）；报道另含三候与养生内容。",
    "rights": "新华社版权稿件；仅记录要点与短摘录。",
    "verification": "human-verified"
  },
  {
    "id": "source-yueling-qishierhou-wikisource",
    "title": "月令七十二候集解（维基文库全文）",
    "authors": [
      "传统题名：吴澄"
    ],
    "publisher": "Wikisource（维基文库）",
    "published": null,
    "url": "https://zh.wikisource.org/wiki/月令七十二候集解",
    "citation": "《月令七十二候集解》，传统题名（元）吴澄撰，维基文库全文本，2026-09-16 读取。",
    "source_type": "historical",
    "access": "direct-read",
    "accessed": "2026-09-16",
    "original_excerpt": "立春，正月節。立，建始也。五行之氣往者過來者續于此。而春木之氣始至，故謂之立也。立夏、秋、冬同。……東風解凍。凍結于冬，遇春風而解散……蟄蟲始振。蟄，藏也；振，動也。密藏之蟲，因氣至，而皆蘇動之矣……魚陟負冰。陟，升也。魚當盛寒伏水底而遂暖，至正月陽氣至，則上遊而近冰，故曰負。",
    "locator": "全书第一节\"立春\"，维基文库全文页；三候条目依次位于立春节之内。",
    "ai_summary": "该书将立春列为全书首节，给出\"立，建始也\"的定义，并按五日一候列立春三候：东风解冻、蛰虫始振、鱼陟负冰，各附简注。紧随其后为雨水节。",
    "rights": "原文属公有领域古籍；维基文库文本依其站点许可提供。仅记录元数据与短摘录。",
    "verification": "human-verified"
  },
  {
    "id": "source-ihchina-guyu-luoyang-mudan",
    "title": "洛阳牡丹花会（国家级非物质文化遗产代表性项目名录项目页）",
    "authors": [
      "中国非物质文化遗产网·中国非物质文化遗产数字博物馆"
    ],
    "publisher": "中国艺术研究院（中国非物质文化遗产保护中心）",
    "published": null,
    "url": "https://www.ihchina.cn/project_details/15243/",
    "citation": "中国非物质文化遗产网：《洛阳牡丹花会》，国家级非遗代表性项目名录项目页（序号1010，编号Ⅹ-103，2008年第二批），2026-09-16 读取。",
    "source_type": "institutional",
    "access": "direct-read",
    "accessed": "2026-09-16",
    "original_excerpt": "项目序号：1010　项目编号：Ⅹ-103　公布时间：2008(第二批)　类别：民俗　所属地区：河南省　申报地区或单位：河南省洛阳市　保护单位：洛阳市文化馆（洛阳市非物质文化遗产保护中心）……从1982年起，牡丹花成为洛阳的\"市花\"，每年4月15日至25日当地都要结合牡丹花期（谷雨时节）举办\"洛阳牡丹花会\"。花会期间，观赏者围绕牡丹开展赏花、观灯、作画、赋诗等文化活动……唐代诗人白居易\"花开花落二十日,一城之人皆若狂\"和刘禹锡\"唯有牡丹真国色，花开时节动京城\"的诗句正是东都洛阳牡丹品赏习俗的生动写照。宋代……欧阳修《洛阳牡丹记》描述说：\"洛阳之俗，大抵好花。春时城中无贵贱皆插花，虽负担者亦然。……\"",
    "locator": "项目页\"项目\"信息栏（序号/编号/批次/类别/地区/保护单位）与项目介绍正文（含唐宋赏花史料引文）。",
    "ai_summary": "国家级非遗名录官方项目页：洛阳牡丹花会，民俗类，河南省洛阳市，2008年第二批公布，编号Ⅹ-103。介绍称牡丹栽培\"源于河洛，至今已有一千六百多年\"，唐宋洛阳赏花之盛有白居易、刘禹锡、欧阳修诗文佐证；1982年牡丹定为洛阳市花，此后每年4月15日至25日\"结合牡丹花期（谷雨时节）\"举办洛阳牡丹花会，活动含赏花、观灯、作画、赋诗。唐宋引文系页面转引，原书核对待做。",
    "rights": "机构官网公开内容；仅记录要点与短摘录。",
    "verification": "human-verified"
  },
  {
    "id": "source-mct-guyu-luoyang-peony",
    "title": "第三十届中国洛阳牡丹文化节（文化和旅游部官网专题）",
    "authors": [
      "中华人民共和国文化和旅游部（官网专题）"
    ],
    "publisher": "中华人民共和国文化和旅游部（mct.gov.cn）",
    "published": null,
    "url": "https://www.mct.gov.cn/preview/special/3578/",
    "citation": "文化和旅游部官网专题：《第三十届中国洛阳牡丹文化节》，2026-09-16 读取。",
    "source_type": "institutional",
    "access": "direct-read",
    "accessed": "2026-09-16",
    "original_excerpt": "中国洛阳牡丹文化节的前身是入选\"国家级非物质文化遗产\"的洛阳牡丹花会……2011年洛阳牡丹花会正式升格为由国家文化部与河南省政府共同主办的中国洛阳牡丹文化节……第1届（1983年4月15日-4月25日）……第2届（1984年4月15日-4月25日）……第30届中国洛阳牡丹文化节将于4月5日开幕。",
    "locator": "专题页沿革介绍与历届档期列表。",
    "ai_summary": "文旅部官网专题：洛阳牡丹花会为国家级非遗项目，1983年首届（4月15日-4月25日），2011年升格为文化部与河南省政府共同主办的\"中国洛阳牡丹文化节\"。注意：本页未出现\"谷雨\"字样，4月档期与牡丹花期的关联表述需引非遗网项目页；历届开幕日并不固定与谷雨同日（第30届为4月5日开幕）。",
    "rights": "政府官网公开内容；仅记录要点与短摘录。",
    "verification": "human-verified"
  },
  {
    "id": "source-xinhua-unesco-solarterms",
    "title": "二十四节气入选《人类非物质文化遗产代表名录》",
    "authors": [
      "新华社记者"
    ],
    "publisher": "新华网",
    "published": "2016-11-30",
    "url": "http://www.xinhuanet.com/politics/2016-11/30/c_129385180.htm",
    "citation": "新华社：《\"二十四节气\"入选联合国教科文组织人类非物质文化遗产代表作名录》，2016-11-30。",
    "source_type": "institutional",
    "access": "direct-read",
    "accessed": "2026-09-16",
    "original_excerpt": "项目全称\"二十四节气——中国人通过观察太阳周年运动而形成的时间知识体系及其实践\"；2006年列入第一批国家级非遗名录；2011年九华立春祭、班春劝农、石阡说春列入扩展名录；2014年三门祭冬、壮族霜降节、苗族赶秋、安仁赶分社列入扩展名录；决议于2016年11月30日在亚的斯亚贝巴举行的第十一届政府间委员会常会通过。",
    "locator": "报道正文；届会地点埃塞俄比亚亚的斯亚贝巴，会议期2016-11-28至12-02。",
    "ai_summary": "国家通讯社通稿，给出入选日期、届会、项目全称、国家级非遗与扩展项目时间线，以及\"形成于黄河流域、以天象气温降水物候时序变化为观察基准\"的描述。",
    "rights": "新华社版权所有；仅引用事实要点与短摘录。",
    "verification": "human-verified"
  },
  {
    "id": "source-ihchina-jiuhua-lichunji",
    "title": "农历二十四节气（九华立春祭）项目页",
    "authors": [
      "中国非物质文化遗产网·中国非物质文化遗产数字博物馆"
    ],
    "publisher": "中国艺术研究院（中国非物质文化遗产保护中心）",
    "published": null,
    "url": "https://www.ihchina.cn/project_details/15060.html",
    "citation": "中国非物质文化遗产网：\"农历二十四节气（九华立春祭）\"，2011年第三批国家级非遗扩展项目，编号Ⅹ-68，浙江省衢州市柯城区。",
    "source_type": "institutional",
    "access": "direct-read",
    "accessed": "2026-09-16",
    "original_excerpt": "以农历立春日为祭祀日，九华梧桐祖殿是立春祭主要活动场所。主要活动有：祭拜春神句芒、迎春接福赐求五谷丰登、供祭品、扮芒神、焚香迎奉、扎春牛、演戏酬神、踏青、鞭春牛等。鞭春牛是整个立春祭活动的重要环节，由选定的人装扮成芒神鞭打春牛。",
    "locator": "项目详情页正文\"基本信息\"与\"主要内容\"部分；项目序号516，保护单位衢州市柯城区文化馆。",
    "ai_summary": "国家级非遗权威机构项目页，确认九华立春祭的申报地、批次、类别（民俗）与仪式构成，鞭春牛为核心环节，与劝农春耕相关联。",
    "rights": "网站版权所有；仅引用事实要点与短摘录。",
    "verification": "human-verified"
  },
  {
    "id": "source-wikisource-suiguangji",
    "title": "歲時廣記（维基文库（四庫全書本·学海类编本，四卷））",
    "authors": [
      "陈元靓（南宋）"
    ],
    "publisher": "维基文库",
    "published": null,
    "url": "https://zh.wikisource.org/wiki/歲時廣記_(四庫全書本)",
    "citation": "陈元靓：《岁时广记》（四库全书本四卷），维基文库，2026-09-25 读取提要与朱鉴序。",
    "source_type": "historical",
    "access": "direct-read",
    "accessed": "2026-09-25",
    "original_excerpt": "提要：按四季分卷，春令四十六條、夏令五十條、秋令三十二條、冬令三十八條（转写自提要；宋陈元靓撰，曹溶学海类编本，原本卷首图说已佚）。",
    "locator": "主页（四库提要+朱鑑序，无正文）；正文在卷一至卷四子页（春/夏/秋/冬）+全覽页。",
    "ai_summary": "宋代岁时类书，唐→清断代链的\"宋环节\"主源；通行四十卷本与此四库四卷本（学海类编）卷帙不同，引文一律以本库所读四卷子页为准。R19-R30按节令读卷一至卷四。",
    "rights": "原文公有领域古籍；维基文库文本依其站点许可。仅元数据与短摘录。",
    "verification": "human-verified"
  }
]