[
  {
    "id": "source-pmo-almanac-qa",
    "title": "历书科普问题解答",
    "authors": [
      "中国科学院紫金山天文台"
    ],
    "publisher": "紫金山天文台官网科普动态",
    "published": "2022-03-17",
    "url": "http://www.pmo.cas.cn/xwdt2019/kpdt2019/202203/t20220317_6399980.html",
    "citation": "中国科学院紫金山天文台：《历书科普问题解答》，2022-03-17。",
    "source_type": "institutional",
    "access": "direct-read",
    "accessed": "2026-09-16",
    "original_excerpt": "一年的二十四节气，反映了地球在绕太阳运行轨道上的不同位置，属于阳历范畴。在阳历中节气日期变化不大，但在农历中节气日期却非常不固定。……农历闰月的安排是人为的规定……取其中最先出现的一个不包含中气（即雨水……）的农历月为闰月。",
    "locator": "\"为什么农历有的月份没有中气\"等问答条目；页面另含农历月大小、年三十有无、双立春/无立春等解答。",
    "ai_summary": "中国历法权威计算机构（紫金山天文台编算《中国天文年历》）的科普问答：节气属阳历成分、农历为阴阳合历；朔日定初一；冬至定十一月；两冬至间含13个朔望月则置闰、取首个无中气之月；节气日期公历稳定、农历漂移的原因；立春2月4日左右与春节1月21日-2月20日变动可产生双立春/无立春年。",
    "rights": "机构官网公开内容；仅引用要点与短摘录。",
    "verification": "human-verified"
  },
  {
    "id": "source-hko-solar-terms",
    "title": "The 24 Solar Terms",
    "authors": [
      "Hong Kong Observatory"
    ],
    "publisher": "Hong Kong Observatory",
    "published": "2020-05-18 (page revision)",
    "url": "https://www.hko.gov.hk/en/gts/time/24solarterms.htm",
    "citation": "Hong Kong Observatory. The 24 Solar Terms. Calendar; revision 18 May 2020.",
    "source_type": "institutional",
    "access": "direct-read",
    "accessed": "2026-09-16",
    "original_excerpt": "The 24 solar terms divide the ecliptic into 24 equal segments, with 15 degrees of the Sun's longitude between the terms.",
    "locator": "Paragraph beginning From the Earth's perspective; next paragraph discusses regional climate and agriculture.",
    "ai_summary": "页面介绍黄经15度分段、节气名称与天气农业经验，并限定为古代中国中部气候的部分反映。",
    "rights": "Source retains rights; metadata and limited excerpt only; no image reuse.",
    "verification": "human-verified"
  },
  {
    "id": "source-xinhua-yushui-feature",
    "title": "节气里的中国丨雨水日：拂水惊梅中迎来春天（新华社稿）",
    "authors": [
      "新华社记者"
    ],
    "publisher": "新华网",
    "published": "2022-02-18",
    "url": "http://www.news.cn/politics/2022-02/18/c_1128392036.htm",
    "citation": "新华社：《雨水日：拂水惊梅中迎来春天》，2022-02-18，2026-09-16 读取。",
    "source_type": "institutional",
    "access": "direct-read",
    "accessed": "2026-09-16",
    "original_excerpt": "雨水，是二十四节气中的第二个节气。每年公历2月18日至20日前后，当太阳到达黄经330度，我们迎来了雨水节气。从此气温回升，雨量渐增，大地万物在雨水滋润中苏醒。……时至雨水节气，太阳的直射点由南半球逐渐向赤道靠近。这时的北半球，日照时数和强度都在增加，气温回升较快，来自海洋的暖湿空气开始活跃，并渐渐向北挺进与冷空气相遇，形成降雨。这个时节，天气变化不定，是全年寒潮过程出现最多的时节之一，忽冷忽热，乍暖还寒。……田野间，越冬作物返青，春耕备耕由南向北次第展开。",
    "locator": "导语段（定义：第二个节气、2月18日至20日前后、黄经330度）；\"时至雨水节气\"气象解释段；雨水三候段；农事段（\"人勤春来早，雨水润春耕\"）。",
    "ai_summary": "新华社\"节气里的中国\"系列雨水稿：黄经330°/公历2月18-20日前后定义、太阳直射点北移与暖湿空气北上成雨的气象解释、寒潮多发乍暖还寒、三候（作\"鸿雁来\"）、引《月令七十二候集解》\"正月中，天一生水……\"、春耕备耕由南向北展开与南北农事差异。",
    "rights": "新华社稿，仅记录元数据与短摘录，全文转载需授权。",
    "verification": "human-verified"
  },
  {
    "id": "source-ihchina-yushui-feature",
    "title": "东风解冻散为雨——二十四节气之雨水（节气专题）",
    "authors": [
      "中国非物质文化遗产网·中国非物质文化遗产数字博物馆（编者整理）"
    ],
    "publisher": "中国艺术研究院（中国非物质文化遗产保护中心）",
    "published": "2018-02-22",
    "url": "https://www.ihchina.cn/solar_details/41.html",
    "citation": "中国非物质文化遗产网：《东风解冻散为雨——二十四节气之雨水》，节气专题页，2026-09-16 读取。",
    "source_type": "institutional",
    "access": "direct-read",
    "accessed": "2026-09-16",
    "original_excerpt": "雨水是二十四节气中的第二个节气，一般从公历2月18日或19日开始，到3月4日或5日结束。2018年的雨水时间是2月19日（农历戊戌年正月初四）。此时，气温回升、冰雪融化、降水增多，故而称为雨水。……我国古代将雨水的十五天分为三候：\"一候獭祭鱼；二候鸿雁来；三候草木萌动。\"……雨水节的习俗中最富人情味的莫过于\"回娘家\"了……出嫁的女儿带着郎君，去给岳父岳母\"接寿\"……另一种经典礼品就是\"罐罐肉\"。",
    "locator": "\"节气概说\"\"三候\"\"气象变化\"\"农事农谚\"\"民俗（回娘家/接寿/罐罐肉/雨水拉保保）\"\"养生（春捂）\"各节；页面另引《月令七十二候集解》\"正月中，天一生水……散而为雨矣\"。",
    "ai_summary": "国家级非遗机构雨水专题：定义（2月18或19日开始、第二个节气）、月令引文、三候（作\"鸿雁来\"，与维基文库《月令七十二候集解》正文\"候雁北\"不同）、农事农谚（春雨贵如油、尺麦怕寸水等，流传地域未逐一标明）、回娘家/接寿/罐罐肉/拉保保等当代习俗叙述（多数未标地域）。注意：\"雨水拉保保\"一段正文经三次读取均不完整（仅标题与配图可确认），逐字引文待复核，本 Source 摘录不含该段。",
    "rights": "机构官网公开内容；图片与字体设计素材一律不用，文字仅作要点与短摘录引用。",
    "verification": "human-verified"
  },
  {
    "id": "source-yueling-qishierhou-wikisource",
    "title": "月令七十二候集解（维基文库全文）",
    "authors": [
      "传统题名：吴澄"
    ],
    "publisher": "Wikisource（维基文库）",
    "published": null,
    "url": "https://zh.wikisource.org/wiki/月令七十二候集解",
    "citation": "《月令七十二候集解》，传统题名（元）吴澄撰，维基文库全文本，2026-09-16 读取。",
    "source_type": "historical",
    "access": "direct-read",
    "accessed": "2026-09-16",
    "original_excerpt": "立春，正月節。立，建始也。五行之氣往者過來者續于此。而春木之氣始至，故謂之立也。立夏、秋、冬同。……東風解凍。凍結于冬，遇春風而解散……蟄蟲始振。蟄，藏也；振，動也。密藏之蟲，因氣至，而皆蘇動之矣……魚陟負冰。陟，升也。魚當盛寒伏水底而遂暖，至正月陽氣至，則上遊而近冰，故曰負。",
    "locator": "全书第一节\"立春\"，维基文库全文页；三候条目依次位于立春节之内。",
    "ai_summary": "该书将立春列为全书首节，给出\"立，建始也\"的定义，并按五日一候列立春三候：东风解冻、蛰虫始振、鱼陟负冰，各附简注。紧随其后为雨水节。",
    "rights": "原文属公有领域古籍；维基文库文本依其站点许可提供。仅记录元数据与短摘录。",
    "verification": "human-verified"
  },
  {
    "id": "source-cnr-guanghan-baobao",
    "title": "正月十六\"拉保保\" 从传统习俗到特色文化名片（央广网）",
    "authors": [
      "央广网记者 王颖"
    ],
    "publisher": "央广网（中央广播电视总台）",
    "published": "2025-02-14",
    "url": "https://sc.cnr.cn/scpd/jdt/20250214/t20250214_527071135.shtml",
    "citation": "央广网：《正月十六\"拉保保\" 从传统习俗到特色文化名片》，2025-02-14，2026-09-16 读取。",
    "source_type": "institutional",
    "access": "direct-read",
    "accessed": "2026-09-16",
    "original_excerpt": "农历正月十六，四川广汉市房湖公园和金雁公园迎来一年一度的保保节暨非遗文化周系列活动……保保节融合了\"游百病\"与\"拉保保\"的传统习俗。\"游百病\"在川西地区古已有之，有\"正月十六游毛病，游了毛病不生病\"的说法……\"拉保保\"，也就是\"拜干爹\"\"认干爹\"，是保保节的核心环节……上午8时30分，\"拉保保\"活动在房湖公园十二株寓意\"百年长寿\"\"百病不生\"的明代古柏树下正式开始……\"拉保保\"习俗起源于清乾隆年间，历经融合演变，2003年被广汉市政府正式命名为\"保保文化节\"，2007年入选首批四川省非物质文化遗产名录。",
    "locator": "导语（正月十六、房湖公园/金雁公园、数十万群众）；习俗源流段（游百病+拉保保）；活动现场段（古柏树下、以\"眼缘\"挑\"保保\"、戴帽子登记合影）；非遗身份段（清乾隆起源说、2003命名、2007省级非遗）。",
    "ai_summary": "央广网对2025年广汉保保节的现场报道：活动日期锚定农历正月十六；流程为家长在房湖公园明代古柏下为孩子现场挑选\"保保\"（干爹），为孩子戴上帽子后登记合影即成\"一家人\"；源流为川西\"游百病\"与\"拉保保\"融合；\"清乾隆年间起源\"为报道转述表述；2003年广汉市政府命名\"保保文化节\"、2007年入选首批四川省非物质文化遗产名录（省级，非国家级）。",
    "rights": "央广网公开报道，仅记录元数据与短摘录。",
    "verification": "human-verified"
  },
  {
    "id": "source-xinhua-guanghan-baobao",
    "title": "四川广汉举行\"拉保保\"民俗活动（图集）",
    "authors": [
      "新华网四川频道（广汉市委宣传部供图）"
    ],
    "publisher": "新华网",
    "published": "2025-02-13",
    "url": "http://sc.news.cn/20250213/26d47f8553854f6c8704b30680c6201e/c.html",
    "citation": "新华网四川频道：《四川广汉举行\"拉保保\"民俗活动》，2025-02-13，2026-09-16 读取。",
    "source_type": "institutional",
    "access": "direct-read",
    "accessed": "2026-09-16",
    "original_excerpt": "2月13日，四川省德阳广汉市房湖公园举行\"拉保保\"民俗活动。（图注）广汉保保节源于川西民俗\"游百病\"和\"拉保保\"，是两个活动相融、发展、演变而来。",
    "locator": "图集首图说明与末段文字说明；画面内容为给\"保保\"戴帽子等现场场景。",
    "ai_summary": "新华网四川频道对2025年广汉拉保保活动的现场图集报道：日期2月13日、地点房湖公园、活动内容（为孩子拉\"保保\"即干爹、戴帽子）；文末简述保保节源于川西\"游百病\"与\"拉保保\"民俗的融合。报道未涉及雨水节气与活动日期的关系。",
    "rights": "新华社图片报道，仅记录元数据与短摘录；图片不使用。",
    "verification": "human-verified"
  },
  {
    "id": "source-xinhua-unesco-solarterms",
    "title": "二十四节气入选《人类非物质文化遗产代表名录》",
    "authors": [
      "新华社记者"
    ],
    "publisher": "新华网",
    "published": "2016-11-30",
    "url": "http://www.xinhuanet.com/politics/2016-11/30/c_129385180.htm",
    "citation": "新华社：《\"二十四节气\"入选联合国教科文组织人类非物质文化遗产代表作名录》，2016-11-30。",
    "source_type": "institutional",
    "access": "direct-read",
    "accessed": "2026-09-16",
    "original_excerpt": "项目全称\"二十四节气——中国人通过观察太阳周年运动而形成的时间知识体系及其实践\"；2006年列入第一批国家级非遗名录；2011年九华立春祭、班春劝农、石阡说春列入扩展名录；2014年三门祭冬、壮族霜降节、苗族赶秋、安仁赶分社列入扩展名录；决议于2016年11月30日在亚的斯亚贝巴举行的第十一届政府间委员会常会通过。",
    "locator": "报道正文；届会地点埃塞俄比亚亚的斯亚贝巴，会议期2016-11-28至12-02。",
    "ai_summary": "国家通讯社通稿，给出入选日期、届会、项目全称、国家级非遗与扩展项目时间线，以及\"形成于黄河流域、以天象气温降水物候时序变化为观察基准\"的描述。",
    "rights": "新华社版权所有；仅引用事实要点与短摘录。",
    "verification": "human-verified"
  },
  {
    "id": "source-ihchina-jiuhua-lichunji",
    "title": "农历二十四节气（九华立春祭）项目页",
    "authors": [
      "中国非物质文化遗产网·中国非物质文化遗产数字博物馆"
    ],
    "publisher": "中国艺术研究院（中国非物质文化遗产保护中心）",
    "published": null,
    "url": "https://www.ihchina.cn/project_details/15060.html",
    "citation": "中国非物质文化遗产网：\"农历二十四节气（九华立春祭）\"，2011年第三批国家级非遗扩展项目，编号Ⅹ-68，浙江省衢州市柯城区。",
    "source_type": "institutional",
    "access": "direct-read",
    "accessed": "2026-09-16",
    "original_excerpt": "以农历立春日为祭祀日，九华梧桐祖殿是立春祭主要活动场所。主要活动有：祭拜春神句芒、迎春接福赐求五谷丰登、供祭品、扮芒神、焚香迎奉、扎春牛、演戏酬神、踏青、鞭春牛等。鞭春牛是整个立春祭活动的重要环节，由选定的人装扮成芒神鞭打春牛。",
    "locator": "项目详情页正文\"基本信息\"与\"主要内容\"部分；项目序号516，保护单位衢州市柯城区文化馆。",
    "ai_summary": "国家级非遗权威机构项目页，确认九华立春祭的申报地、批次、类别（民俗）与仪式构成，鞭春牛为核心环节，与劝农春耕相关联。",
    "rights": "网站版权所有；仅引用事实要点与短摘录。",
    "verification": "human-verified"
  }
]