[
  {
    "id": "source-pmo-almanac-qa",
    "title": "历书科普问题解答",
    "authors": [
      "中国科学院紫金山天文台"
    ],
    "publisher": "紫金山天文台官网科普动态",
    "published": "2022-03-17",
    "url": "http://www.pmo.cas.cn/xwdt2019/kpdt2019/202203/t20220317_6399980.html",
    "citation": "中国科学院紫金山天文台：《历书科普问题解答》，2022-03-17。",
    "source_type": "institutional",
    "access": "direct-read",
    "accessed": "2026-09-16",
    "original_excerpt": "一年的二十四节气，反映了地球在绕太阳运行轨道上的不同位置，属于阳历范畴。在阳历中节气日期变化不大，但在农历中节气日期却非常不固定。……农历闰月的安排是人为的规定……取其中最先出现的一个不包含中气（即雨水……）的农历月为闰月。",
    "locator": "\"为什么农历有的月份没有中气\"等问答条目；页面另含农历月大小、年三十有无、双立春/无立春等解答。",
    "ai_summary": "中国历法权威计算机构（紫金山天文台编算《中国天文年历》）的科普问答：节气属阳历成分、农历为阴阳合历；朔日定初一；冬至定十一月；两冬至间含13个朔望月则置闰、取首个无中气之月；节气日期公历稳定、农历漂移的原因；立春2月4日左右与春节1月21日-2月20日变动可产生双立春/无立春年。",
    "rights": "机构官网公开内容；仅引用要点与短摘录。",
    "verification": "human-verified"
  },
  {
    "id": "source-hko-solar-terms",
    "title": "The 24 Solar Terms",
    "authors": [
      "Hong Kong Observatory"
    ],
    "publisher": "Hong Kong Observatory",
    "published": "2020-05-18 (page revision)",
    "url": "https://www.hko.gov.hk/en/gts/time/24solarterms.htm",
    "citation": "Hong Kong Observatory. The 24 Solar Terms. Calendar; revision 18 May 2020.",
    "source_type": "institutional",
    "access": "direct-read",
    "accessed": "2026-09-16",
    "original_excerpt": "The 24 solar terms divide the ecliptic into 24 equal segments, with 15 degrees of the Sun's longitude between the terms.",
    "locator": "Paragraph beginning From the Earth's perspective; next paragraph discusses regional climate and agriculture.",
    "ai_summary": "页面介绍黄经15度分段、节气名称与天气农业经验，并限定为古代中国中部气候的部分反映。",
    "rights": "Source retains rights; metadata and limited excerpt only; no image reuse.",
    "verification": "human-verified"
  },
  {
    "id": "source-ihchina-dahan-feature",
    "title": "岁有大寒知——二十四节气之大寒（节气专题）",
    "authors": [
      "中国非物质文化遗产网·中国非物质文化遗产数字博物馆（编者整理）"
    ],
    "publisher": "中国艺术研究院（中国非物质文化遗产保护中心）",
    "published": "2018-01-19",
    "url": "https://www.ihchina.cn/solar_details/6984.html",
    "citation": "中国非物质文化遗产网：《岁有大寒知——二十四节气之大寒》，节气专题页，2026-09-16 读取。",
    "source_type": "institutional",
    "access": "direct-read",
    "accessed": "2026-09-16",
    "original_excerpt": "大寒是二十四节气中的最后一个，每年1月20日前后，太阳到达黄经300°时即为大寒，今年的大寒时间是1月20日（农历丁酉年腊月初四）。至此，节气轮回，下一个节气就是立春，新一轮的循环往复即将到来。……古人认为：\"大寒为中者，上形于小寒，故谓之大……寒气之逆极，故谓大寒。\"（《授时通考·天时》引《三礼义宗》）……一候鸡乳；二候征鸟厉疾；三候水泽腹坚。……尾牙源自于拜土地公做\"牙\"的习俗，在中国福建沿海、台湾等地仍保留着尾牙祭的传统。所谓农历二月二为\"头牙\"，以后每逢初二和十六都要做\"牙\"，到了农历十二月十六日正好是尾牙。……广东佛山民间有大寒时节用瓦锅蒸煮糯米饭的习俗，安徽安庆有大寒炸春卷的做法，南京则有大寒炖鸡喝鸡汤的食俗。",
    "locator": "\"节气概说\"\"农事农谚\"\"节气习俗（尾牙祭/腊八粥/消寒糕）\"\"节气养生\"各节；配图11幅仅作版式，不引用。",
    "ai_summary": "国家级非遗机构大寒专题：定义（最后一个节气、1月20日前后、黄经300°、节气轮回下一个是立春）、命名引《授时通考·天时》转《三礼义宗》\"寒气之逆极\"、三候（鸡乳/征鸟厉疾/水泽腹坚）与江南二十四番花信（瑞香/兰花/山矾）、农事（北方积肥堆肥与牲畜防寒、南方小麦田间管理、广东岭南联合捉田鼠）、农谚约12条（\"大寒不寒，春分不暖\"\"过了大寒，又是一年\"等）、习俗（尾牙祭锚定农历十二月十六且地域限福建沿海台湾、腊八粥、老北京消寒糕）、养生段含地域食俗（佛山糯米饭/安庆春卷/南京炖鸡）。",
    "rights": "页面声明\"部分图文内容来自网络，经编者整理，转载或引用请注明作者及出处\"——引用需谨慎，配图一律不用。",
    "verification": "human-verified"
  },
  {
    "id": "source-xinhua-dahan-topic",
    "title": "【传统文化•二十四节气】大寒",
    "authors": [
      "新华网（栏目\"新时空\"）"
    ],
    "publisher": "新华网",
    "published": null,
    "url": "http://www.xinhuanet.com/culture/topic/zhuanti/20181/675.html",
    "citation": "新华网：《【传统文化•二十四节气】大寒》专题页导语，2026-09-16 读取。",
    "source_type": "institutional",
    "access": "direct-read",
    "accessed": "2026-09-16",
    "original_excerpt": "每年1月20日前后太阳到达黄经300°时为\"大寒\"……大寒是二十四节气中最后一个节气……大寒，是天气寒冷到极点的意思。",
    "locator": "专题页导语段（页面其余内容在\"开始阅读\"展开层，本轮未读取）。",
    "ai_summary": "新华网二十四节气专题之大寒页导语：1月20日前后、黄经300°、最后一个节气、\"天气寒冷到极点\"的释义。展开正文未读取，仅以导语层作为独立机构交叉源。",
    "rights": "新华网公开专题页；仅引用要点与短摘录。",
    "verification": "human-verified"
  },
  {
    "id": "source-weathercn-dahan-2023",
    "title": "大寒迎岁终！全国平均气温触底反弹 数据揭秘谁是大寒\"湿冷王\"（中国天气网）",
    "authors": [
      "中国天气网（中国气象局主办气象服务网站）"
    ],
    "publisher": "中国天气网",
    "published": "2023-01-20",
    "url": "http://news.weather.com.cn/2023/01/3593917.shtml",
    "citation": "中国天气网：《大寒迎岁终！全国平均气温触底反弹 数据揭秘谁是大寒\"湿冷王\"》，2023-01-20，2026-09-16 读取。",
    "source_type": "scientific",
    "access": "direct-read",
    "accessed": "2026-09-16",
    "original_excerpt": "中国天气网盘点1991年至2020年节气大数据发现，在小寒期间，全国平均气温跌到全年最低，仅有-5.1℃。……而到了大寒节气，气温开启反弹之旅，比小寒上升0.6℃，达到-4.5℃。……也有不少地方是在大寒节气达到全年最低，比如华东和华南沿海、新疆北部、山东半岛局地部分地区……总体而言，南方冷在大寒的区域相对更多一些。……大寒是二十四节气中最后一个节气，\"寒气之逆极，故谓大寒。\"",
    "locator": "文中\"节气大数据\"段（小寒-5.1℃/大寒-4.5℃）、\"南北差异\"段、\"湿冷王\"排行段（贵阳4.5天居榜首，云贵准静止锋解释）。",
    "ai_summary": "中国天气网（中国气象局旗下）大寒节气数据稿：1991-2020年统计下小寒为全国平均气温最低节气（-5.1℃），大寒回升0.6℃至-4.5℃——\"名字更大的大寒并非全国平均最冷\"；但华东和华南沿海、新疆北部、山东半岛局地在达全年最低，\"南方冷在大寒的区域相对更多\"；大寒期间湿冷日数排行贵阳居首（4.5天，云贵准静止锋成因），长沙合肥武汉南昌为代表；另含\"最后一个节气\"\"寒气之逆极\"命名引文与\"过了大寒，又是一年\"俗语。",
    "rights": "中国天气网公开稿件；仅引用要点与短摘录。",
    "verification": "human-verified"
  },
  {
    "id": "source-rmrbhwb-dahan-2016",
    "title": "二十四节气·大寒（第07版专版：节气·民俗／节气·物候／诗意·大寒／大寒过了就是年）",
    "authors": [
      "熊慕东（民俗篇）；物候篇作者署名待核（版面责编：赖睿）"
    ],
    "publisher": "人民日报海外版（人民网电子版）",
    "published": "2016-01-19",
    "url": "https://paper.people.com.cn/rmrbhwb/html/2016-01/19/content_1648828.htm",
    "citation": "人民日报海外版2016年1月19日第07版《二十四节气·大寒》专版（民俗篇content_1648828、物候篇content_1648830），2026-09-16 读取。",
    "source_type": "institutional",
    "access": "direct-read",
    "accessed": "2026-09-16",
    "original_excerpt": "（物候篇）大寒，是二十四节气中的最后一个节气，也是腊月的代表节气（即\"中气\"）。它一般都落在公历1月20日前后，这时太阳到达黄经300°，今年的大寒交节时刻为1月20日23时27分。……按气象资料，中国大部分地区都是小寒前后温度最低……大寒期间的平均温度仅仅是比小寒高出1℃—2℃而已……在有些年份，大寒期间的温度确实会比小寒还低。……《授时通考》称\"寒气之逆极，故谓大寒\"……古代将大寒分为三候：\"一候鸡乳，二候征鸟厉疾，三候水泽腹坚。\"\"鸡乳\"即母鸡孵小鸡；\"征鸟厉疾\"指猛禽需强力捕食，以补充身体的能量、抵御严寒；\"水泽腹坚\"则是说湖泊表面的冰已经坚实地一直冻到水面中央了。……（民俗篇）尾牙源自于拜土地公做\"牙\"的习俗。所谓二月二为头牙，以后每逢初二和十六都要做\"牙\"，到了农历十二月十六正好是尾牙。……时至今日，尾牙祭已经慢慢退出了大寒习俗，但中国福建沿海、台湾等一些地方仍保留着尾牙祭的传统。……在大寒至立春这段时间，有很多重要的民俗和节庆。如尾牙祭、祭灶和除夕等，有时甚至连中国最大的节庆春节也处于这一节气中。",
    "locator": "第07版四篇：民俗篇（content_1648828，署名熊慕东）、\"大寒过了就是年\"（1648829）、物候篇（1648830）、诗意·大寒《元沙院》（1648831）；本轮直读民俗篇与物候篇全文、浏览1648829/1648831。",
    "ai_summary": "中央权威媒体大寒专版。物候篇：大寒为最后一个节气且是腊月中气、1月20日前后黄经300°（2016年交节时刻1月20日23时27分）、气象资料下大部分地区小寒前后最冷而大寒仅高1-2℃且个别年份更低、《授时通考》命名引文、三候白话释义、元稹《咏廿四气诗·大寒十二月中》全诗转录。民俗篇：广东糯米饭（\"小寒大寒，无风自寒\"民谚）、南京\"一九一只鸡\"鸡汤与羹食、尾牙（做牙体系、农历十二月十六、福建沿海台湾留存、鸡头俗说以\"据说\"引出）、岭南捉田鼠、太岁交承搬家破土无忌的说法、祭灶（腊月廿三）、除夕踩岁（芝麻秸）——并给出\"大寒至立春时段内含尾牙祭/祭灶/除夕/春节\"的时段重叠表述。",
    "rights": "人民网电子版报纸内容（\"人民网版杈所有，未经书面授权禁止使用\"）；仅引用要点与短摘录，全文不转载。",
    "verification": "human-verified"
  },
  {
    "id": "source-yueling-qishierhou-wikisource",
    "title": "月令七十二候集解（维基文库全文）",
    "authors": [
      "传统题名：吴澄"
    ],
    "publisher": "Wikisource（维基文库）",
    "published": null,
    "url": "https://zh.wikisource.org/wiki/月令七十二候集解",
    "citation": "《月令七十二候集解》，传统题名（元）吴澄撰，维基文库全文本，2026-09-16 读取。",
    "source_type": "historical",
    "access": "direct-read",
    "accessed": "2026-09-16",
    "original_excerpt": "立春，正月節。立，建始也。五行之氣往者過來者續于此。而春木之氣始至，故謂之立也。立夏、秋、冬同。……東風解凍。凍結于冬，遇春風而解散……蟄蟲始振。蟄，藏也；振，動也。密藏之蟲，因氣至，而皆蘇動之矣……魚陟負冰。陟，升也。魚當盛寒伏水底而遂暖，至正月陽氣至，則上遊而近冰，故曰負。",
    "locator": "全书第一节\"立春\"，维基文库全文页；三候条目依次位于立春节之内。",
    "ai_summary": "该书将立春列为全书首节，给出\"立，建始也\"的定义，并按五日一候列立春三候：东风解冻、蛰虫始振、鱼陟负冰，各附简注。紧随其后为雨水节。",
    "rights": "原文属公有领域古籍；维基文库文本依其站点许可提供。仅记录元数据与短摘录。",
    "verification": "human-verified"
  },
  {
    "id": "source-xinhua-unesco-solarterms",
    "title": "二十四节气入选《人类非物质文化遗产代表名录》",
    "authors": [
      "新华社记者"
    ],
    "publisher": "新华网",
    "published": "2016-11-30",
    "url": "http://www.xinhuanet.com/politics/2016-11/30/c_129385180.htm",
    "citation": "新华社：《\"二十四节气\"入选联合国教科文组织人类非物质文化遗产代表作名录》，2016-11-30。",
    "source_type": "institutional",
    "access": "direct-read",
    "accessed": "2026-09-16",
    "original_excerpt": "项目全称\"二十四节气——中国人通过观察太阳周年运动而形成的时间知识体系及其实践\"；2006年列入第一批国家级非遗名录；2011年九华立春祭、班春劝农、石阡说春列入扩展名录；2014年三门祭冬、壮族霜降节、苗族赶秋、安仁赶分社列入扩展名录；决议于2016年11月30日在亚的斯亚贝巴举行的第十一届政府间委员会常会通过。",
    "locator": "报道正文；届会地点埃塞俄比亚亚的斯亚贝巴，会议期2016-11-28至12-02。",
    "ai_summary": "国家通讯社通稿，给出入选日期、届会、项目全称、国家级非遗与扩展项目时间线，以及\"形成于黄河流域、以天象气温降水物候时序变化为观察基准\"的描述。",
    "rights": "新华社版权所有；仅引用事实要点与短摘录。",
    "verification": "human-verified"
  },
  {
    "id": "source-ihchina-jiuhua-lichunji",
    "title": "农历二十四节气（九华立春祭）项目页",
    "authors": [
      "中国非物质文化遗产网·中国非物质文化遗产数字博物馆"
    ],
    "publisher": "中国艺术研究院（中国非物质文化遗产保护中心）",
    "published": null,
    "url": "https://www.ihchina.cn/project_details/15060.html",
    "citation": "中国非物质文化遗产网：\"农历二十四节气（九华立春祭）\"，2011年第三批国家级非遗扩展项目，编号Ⅹ-68，浙江省衢州市柯城区。",
    "source_type": "institutional",
    "access": "direct-read",
    "accessed": "2026-09-16",
    "original_excerpt": "以农历立春日为祭祀日，九华梧桐祖殿是立春祭主要活动场所。主要活动有：祭拜春神句芒、迎春接福赐求五谷丰登、供祭品、扮芒神、焚香迎奉、扎春牛、演戏酬神、踏青、鞭春牛等。鞭春牛是整个立春祭活动的重要环节，由选定的人装扮成芒神鞭打春牛。",
    "locator": "项目详情页正文\"基本信息\"与\"主要内容\"部分；项目序号516，保护单位衢州市柯城区文化馆。",
    "ai_summary": "国家级非遗权威机构项目页，确认九华立春祭的申报地、批次、类别（民俗）与仪式构成，鞭春牛为核心环节，与劝农春耕相关联。",
    "rights": "网站版权所有；仅引用事实要点与短摘录。",
    "verification": "human-verified"
  }
]